"uid","answer","question","subject","option1","option2","option3","option4","explanation"
267,"The Scouring of the Shire","In 'The Lord of the Rings,' what event involves the Hobbits returning to the Shire, only to discover that it has been taken over by ruffians and corrupted by the influence of Lotho Sackville-Baggins and Saruman?","Lord Of The Rings","The Scouring of the Shire","The Grey Havens","The Last of the Noldor","Elendil's Sword","'The Scouring of the Shire' is a pivotal event."
268,"The Grey Havens","Where do Frodo, Gandalf, Bilbo, and many Elves depart to from the shores of Middle-earth at the end of 'The Lord of the Rings,' leaving behind their mortal lives and sailing to a land across the sea?","Lord Of The Rings","The Grey Havens","The Last of the Noldor","Elendil's Sword","Isildur's Bane","'The Grey Havens' is the departing place."
269,"The Last of the Noldor","In 'The Lord of the Rings,' which chapter is primarily about the departure of the Elves from Middle-earth, marking the end of their presence in the land?","Lord Of The Rings","The Last of the Noldor","Elendil's Sword","Isildur's Bane","The Last Debate","'The Last of the Noldor' is a significant chapter."
270,"Elendil's Sword","What is the name of the sword that Aragorn wields, which originally belonged to Elendil, and it is reforged by the Elves and used by Aragorn as the symbol of his claim to the throne of Gondor?","Lord Of The Rings","Elendil's Sword","Isildur's Bane","The Last Debate","The Field of Cormallen","'Elendil's Sword' is an important weapon."
271,"Isildur's Bane","In 'The Lord of the Rings,' what term is used to refer to the One Ring, especially in the context of its corrupting influence and its ability to control those who possess it?","Lord Of The Rings","Isildur's Bane","Elendil's Sword","The Last Debate","The Field of Cormallen","'Isildur's Bane' is a significant concept."
272,"The Last Debate","Which chapter in 'The Lord of the Rings' depicts a discussion among the leaders of the Free Peoples of Middle-earth as they decide how to address the threat of Sauron and his armies before the final battle?","Lord Of The Rings","The Last Debate","Elendil's Sword","Isildur's Bane","The Field of Cormallen","'The Last Debate' is a pivotal chapter."
273,"The Field of Cormallen","In 'The Lord of the Rings,' what is the name of the location where the victorious Free Peoples of Middle-earth gather to celebrate their victory over Sauron and his forces following the Battle of the Morannon?","Lord Of The Rings","The Field of Cormallen","The Steward and the King","Many Partings","Homeward Bound","'The Field of Cormallen' is a joyful place."
274,"The Steward and the King","What chapter in 'The Lord of the Rings' describes Aragorn's return to Gondor, his reunion with Arwen, and his coronation as King Elessar Telcontar?","Lord Of The Rings","The Steward and the King","Many Partings","Homeward Bound","The Scouring of the Shire","'The Steward and the King' is a momentous chapter."
275,"Many Partings","In 'The Lord of the Rings,' which chapter focuses on the farewells and departures of various characters as they go their separate ways after the defeat of Sauron?","Lord Of The Rings","Many Partings","Homeward Bound","The Scouring of the Shire","The Grey Havens","'Many Partings' is a chapter of farewells."
276,"Homeward Bound","What chapter in 'The Lord of the Rings' describes the journey of the Hobbits as they return to the Shire after their adventures, only to find it changed and in need of their intervention?","Lord Of The Rings","Homeward Bound","The Scouring of the Shire","The Grey Havens","The Last of the Noldor","'Homeward Bound' is a significant chapter."
277,"The Scouring of the Shire","In 'The Lord of the Rings,' what event involves the Hobbits returning to the Shire, only to discover that it has been taken over by ruffians and corrupted by the influence of Lotho Sackville-Baggins and Saruman?","Lord Of The Rings","The Scouring of the Shire","The Grey Havens","The Last of the Noldor","Elendil's Sword","'The Scouring of the Shire' is a pivotal event."
278,"The Grey Havens","Where do Frodo, Gandalf, Bilbo, and many Elves depart to from the shores of Middle-earth at the end of 'The Lord of the Rings,' leaving behind their mortal lives and sailing to a land across the sea?","Lord Of The Rings","The Grey Havens","The Last of the Noldor","Elendil's Sword","Isildur's Bane","'The Grey Havens' is the departing place."
279,"The Shire Calendar","In 'The Lord of the Rings,' what is the name of the calendar used by the Hobbits to reckon time and events in the Shire?","Lord Of The Rings","The Shire Calendar","Many Partings","Homeward Bound","The Scouring of the Shire","The Grey Havens","The Shire Calendar is a notable feature of Hobbit life."
280,"The Red Arrow","In 'The Lord of the Rings,' what is the name of the token that Denethor, the Steward of Gondor, receives from Boromir to request aid from Rohan in the form of reinforcements?","Lord Of The Rings","The Red Arrow","The Stone of Erech","The Dead Men of Dunharrow","The Black Serpent of Harad","'The Red Arrow' is a significant token."
281,"The Stone of Erech","What is the name of the ominous stone or hill in 'The Lord of the Rings' that serves as the gathering place for the Dead Men of Dunharrow, whom Aragorn calls upon to fulfill their oath and aid in the War of the Ring?","Lord Of The Rings","The Stone of Erech","The Dead Men of Dunharrow","The Black Serpent of Harad","The Haradrim","'The Stone of Erech' plays a crucial role."
282,"The Dead Men of Dunharrow","In 'The Lord of the Rings,' who are the spectral and cursed warriors of the Oathbreakers who answer Aragorn's call for aid at the Stone of Erech?","Lord Of The Rings","The Dead Men of Dunharrow","The Black Serpent of Harad","The Haradrim","Prince Imrahil","'The Dead Men of Dunharrow' are essential to the story."
283,"The Black Serpent of Harad","What is the symbol or emblem that represents the forces of Harad, particularly the Haradrim warriors who fight for Sauron during the Battle of the Pelennor Fields in 'The Lord of the Rings'?","Lord Of The Rings","The Black Serpent of Harad","The Haradrim","Prince Imrahil","The Horn of Gondor","The 'Black Serpent of Harad' is a distinctive symbol."
284,"The Haradrim","In 'The Lord of the Rings,' what is the collective name for the people and warriors from the lands of Harad who ally with Sauron and take part in the conflict against Gondor and the Free Peoples of Middle-earth?","Lord Of The Rings","The Haradrim","Prince Imrahil","The Horn of Gondor","The Corsairs of Umbar","The Haradrim are significant adversaries."
285,"Prince Imrahil","Who is the noble leader of the Swan Knights of Dol Amroth and a trusted ally of Gondor in 'The Lord of the Rings'?","Lord Of The Rings","Prince Imrahil","The Horn of Gondor","The Corsairs of Umbar","The Battle of the Pelennor Fields","'Prince Imrahil' is a notable character."
286,"The Horn of Gondor","What is the name of the horn that Boromir carries as a member of the Fellowship of the Ring, which is blown in a moment of dire need to call for aid during an Orc attack in 'The Lord of the Rings'?","Lord Of The Rings","The Horn of Gondor","The Corsairs of Umbar","The Battle of the Pelennor Fields","The Corsair Ships","The 'Horn of Gondor' is an important item."
287,"The Corsairs of Umbar","In 'The Lord of the Rings,' who are the seafaring pirates and mariners from Umbar who serve as allies to Sauron and attack the city of Minas Tirith with their ships during the War of the Ring?","Lord Of The Rings","The Corsairs of Umbar","The Battle of the Pelennor Fields","The Corsair Ships","The Destruction of the Ring","The 'Corsairs of Umbar' are formidable foes."
288,"The Battle of the Pelennor Fields","Which major battle takes place in 'The Lord of the Rings' outside the walls of Minas Tirith, where the combined forces of Gondor and Rohan face Sauron's armies, including the Witch-king of Angmar and the Haradrim?","Lord Of The Rings","The Battle of the Pelennor Fields","The Corsair Ships","The Destruction of the Ring","The Return of the King","The 'Battle of the Pelennor Fields' is a pivotal conflict."
289,"The Corsair Ships","What term is used in 'The Lord of the Rings' to describe the fleet of ships from Umbar that arrives to besiege Gondor, bringing reinforcements to Sauron's forces during the War of the Ring?","Lord Of The Rings","The Corsair Ships","The Destruction of the Ring","The Return of the King","The Grey Havens","'The Corsair Ships' are a key element."
290,"The Destruction of the Ring","In 'The Lord of the Rings,' what event marks the final and ultimate defeat of Sauron, as the One Ring is destroyed in the fires of Mount Doom by Frodo Baggins and the Ring's evil power is vanquished?","Lord Of The Rings","The Destruction of the Ring","The Return of the King","The Grey Havens","The Departure of Frodo","The 'Destruction of the Ring' is a climactic moment."
291,"The Return of the King","What is the title of the third volume of 'The Lord of the Rings,' which refers to Aragorn's ascension to the throne of Gondor and the restoration of peace and order in Middle-earth following the defeat of Sauron?","Lord Of The Rings","The Return of the King","The Grey Havens","The Departure of Frodo","The Red Book of Westmarch","'The Return of the King' is a significant volume."
292,"The Grey Havens","Where do Frodo, Gandalf, Bilbo, and many Elves depart to from the shores of Middle-earth at the end of 'The Lord of the Rings,' leaving behind their mortal lives and sailing to a land across the sea?","Lord Of The Rings","The Grey Havens","The Departure of Frodo","The Red Book of Westmarch","The Shire Reckoning","'The Grey Havens' is the departing place."
293,"The Departure of Frodo","What chapter in 'The Lord of the Rings' describes the final journey of Frodo Baggins and his departure from Middle-earth, accompanied by Gandalf, Bilbo, and the Elves, as they sail to the Undying Lands?","Lord Of The Rings","The Departure of Frodo","The Red Book of Westmarch","The Shire Reckoning","The Black Serpent of Harad","'The Departure of Frodo' is a momentous chapter."
294,"The Red Book of Westmarch","In 'The Lord of the Rings,' what is the title of the book or manuscript that contains the account of Bilbo and Frodo's adventures and is the source of the story's narrative, as well as the work from which Tolkien draws his own inspiration as a fictional translator and scholar?","Lord Of The Rings","The Red Book of Westmarch","The Shire Reckoning","The Grey Havens","The Departure of Frodo","The 'Red Book of Westmarch' is a crucial element."
295,"The Shire Reckoning","What system or calendar is used by the Hobbits to reckon time and events within the Shire in 'The Lord of the Rings'?","Lord Of The Rings","The Shire Reckoning","The Grey Havens","The Departure of Frodo","The Red Book of Westmarch","The Shire Reckoning is a notable aspect of Hobbit culture."
