"uid","answer","question","subject","option1","option2","option3","option4","explanation"
102,"The White Tree of Gondor","What ancient and revered symbol of Gondor is kept in the court of Minas Tirith and represents the line of kings in 'Lord of the Rings'?","Lord Of The Rings","Galadriel's Phial","The Mirror of Galadriel","The Palantir of Orthanc","The White Tree of Gondor","The White Tree symbolizes the line of kings in Gondor."
103,"The Red Book of Westmarch","What is the name of the book that Bilbo and Frodo write and compile their adventures and experiences in 'Lord of the Rings'?","Lord Of The Rings","Galadriel's Phial","The Mirror of Galadriel","The Palantir of Orthanc","The Red Book of Westmarch","The Red Book records their adventures."
104,"Durin III","Who is the Dwarf King of Khazad-dûm and the third king of Durin's Folk in 'Lord of the Rings'?","Lord Of The Rings","Galadriel's Phial","The Mirror of Galadriel","The Palantir of Orthanc","Durin III","Durin III is the Dwarf King of Khazad-dûm."
105,"Radagast's Staff","Which Istari wizard carries a staff and is known for his connection to animals and nature in 'Lord of the Rings'?","Lord Of The Rings","Galadriel's Phial","The Mirror of Galadriel","The Palantir of Orthanc","Radagast's Staff","Radagast is known for his staff and connection to nature."
106,"Tom Bombadil's Hat","What unique and mysterious character in 'Lord of the Rings' wears a hat adorned with a feather and is unaffected by the One Ring's power?","Lord Of The Rings","Galadriel's Phial","The Mirror of Galadriel","The Palantir of Orthanc","Tom Bombadil's Hat","Tom Bombadil is the character with the unique hat."
107,"The Prancing Pony Innkeeper","Who is the innkeeper of the Prancing Pony in Bree, where the hobbits meet Aragorn in 'Lord of the Rings'?","Lord Of The Rings","The Prancing Pony Innkeeper","Glóin","Bifur","Bofur","The innkeeper of the Prancing Pony is a notable character."
108,"Glóin","Which member of Thorin Oakenshield's company, and father of Gimli, appears in 'Lord of the Rings'?","Lord Of The Rings","The Prancing Pony Innkeeper","Glóin","Bifur","Bofur","Glóin is a member of Thorin's company."
109,"Bifur","Which dwarf from Thorin Oakenshield's company shares a similar name with his cousins Bofur and Bombur in 'Lord of the Rings'?","Lord Of The Rings","The Prancing Pony Innkeeper","Glóin","Bifur","Bofur","Bifur shares a similar name with his cousins."
110,"Bofur","Which dwarf from Thorin Oakenshield's company shares a similar name with his cousins Bifur and Bombur in 'Lord of the Rings'?","Lord Of The Rings","The Prancing Pony Innkeeper","Glóin","Bifur","Bofur","Bofur shares a similar name with his cousins."
111,"Thrain","Who is the father of Thorin Oakenshield and the King of Durin's Folk before his disappearance in 'Lord of the Rings'?","Lord Of The Rings","The Prancing Pony Innkeeper","Glóin","Bifur","Thrain","Thrain is the father of Thorin Oakenshield."
112,"Dwalin","Which dwarf from Thorin Oakenshield's company is known for his hooded cloak and large war-hammer in 'Lord of the Rings'?","Lord Of The Rings","The Prancing Pony Innkeeper","Glóin","Dwalin","Kili","Dwalin is known for his hooded cloak and war-hammer."
113,"Kili","Which young dwarf from Thorin Oakenshield's company has a close relationship with his brother Fili in 'Lord of the Rings'?","Lord Of The Rings","The Prancing Pony Innkeeper","Kili","Fili","Balimund","Yavanna","Kili has a close relationship with his brother Fili."
114,"Fili","Which dwarf from Thorin Oakenshield's company is the brother of Kili and known for his fair hair in 'Lord of the Rings'?","Lord Of The Rings","The Prancing Pony Innkeeper","Kili","Fili","Balimund","Yavanna","Fili is the brother of Kili and known for his fair hair."
115,"Balimund","Who is a skilled blacksmith in Whiterun and provides training in the Smithing skill in 'The Elder Scrolls V: Skyrim'?","Lord Of The Rings","The Prancing Pony Innkeeper","Glóin","Bifur","Balimund","Yavanna","Balimund is a character from 'Skyrim,' not 'Lord of the Rings.'"
116,"Yavanna","Which Valar is responsible for the creation of plants and is often associated with nature in 'The Silmarillion'?","Lord Of The Rings","The Prancing Pony Innkeeper","Glóin","Bifur","Yavanna","Varda","Yavanna is a Valar associated with nature in 'The Silmarillion.'"
117,"Varda","Which Valar is also known as Elbereth and is associated with the stars and light in 'The Silmarillion'?","Lord Of The Rings","The Prancing Pony Innkeeper","Glóin","Bifur","Yavanna","Varda","Varda is also known as Elbereth and associated with stars and light."
118,"Manwe","Who is the King of the Valar and the chief of the Ainur in 'The Silmarillion'?","Lord Of The Rings","The Prancing Pony Innkeeper","Glóin","Bifur","Manwe","Aulë","Manwe is the King of the Valar in 'The Silmarillion.'"
119,"Aulë","Which Valar is known as the Smith and the creator of the Dwarves in 'The Silmarillion'?","Lord Of The Rings","The Prancing Pony Innkeeper","Glóin","Bifur","Manwe","Aulë","Aulë is known as the Smith and creator of the Dwarves in 'The Silmarillion.'"
120,"Melkor","Who is the fallen Vala also known as Morgoth and the primary antagonist in 'The Silmarillion'?","Lord Of The Rings","The Prancing Pony Innkeeper","Glóin","Bifur","Manwe","Melkor","Melkor is the fallen Vala and primary antagonist in 'The Silmarillion.'"
121,"Ulmo","Which Valar is associated with water and is the Lord of Waters in 'The Silmarillion'?","Lord Of The Rings","Ulmo","Valinor","Narsil","Anduril","Ulmo is the Valar associated with water."
122,"Valinor","What is the name of the Undying Lands where the Valar and the Eldar dwell in 'The Silmarillion'?","Lord Of The Rings","Ulmo","Valinor","Narsil","Anduril","Valinor is the Undying Lands of the Valar and Eldar."
123,"Narsil","What is the name of the shattered sword of Elendil, which is reforged into a new blade for Aragorn in 'Lord of the Rings'?","Lord Of The Rings","Ulmo","Valinor","Narsil","Anduril","Narsil is the shattered sword of Elendil."
124,"Anduril","What is the name of the reforged sword from the shards of Narsil, carried by Aragorn as the King of Gondor in 'Lord of the Rings'?","Lord Of The Rings","Ulmo","Valinor","Narsil","Anduril","Anduril is the reforged sword carried by Aragorn."
125,"Sting","What is the name of the small Elvish blade given to Frodo by Bilbo, which glows blue when orcs are nearby in 'Lord of the Rings'?","Lord Of The Rings","Ulmo","Sting","Glamdring","Orcrist","Sting is the small Elvish blade given to Frodo."
126,"Glamdring","What is the name of Gandalf's sword, which is also known as the Foe-hammer, in 'Lord of the Rings'?","Lord Of The Rings","Ulmo","Sting","Glamdring","Orcrist","Glamdring is Gandalf's sword."
127,"Orcrist","What is the name of the sword found by Thorin Oakenshield in a troll-hoard, which he later wields in 'The Hobbit'?","Lord Of The Rings","Ulmo","Sting","Glamdring","Orcrist","Orcrist is the sword found by Thorin in 'The Hobbit.'"
128,"Legolas' Arrows","What are the weapons primarily used by Legolas, the Elf of the Fellowship, in 'Lord of the Rings'?","Lord Of The Rings","Ulmo","Legolas' Arrows","Mithrandir","Radagast's Birds","The Prancing Pony Bard","Legolas primarily uses arrows as his weapons."
129,"Mithrandir","What is the Elvish name for Gandalf, one of the Istari wizards, in 'The Silmarillion'?","Lord Of The Rings","Ulmo","Valinor","Narsil","Mithrandir","Mithrandir is the Elvish name for Gandalf."
130,"Radagast's Birds","What animals are used by Radagast the Brown to send messages and communicate with the creatures of Middle-earth in 'Lord of the Rings'?","Lord Of The Rings","Ulmo","Valinor","Radagast's Birds","The Prancing Pony Bard","Radagast uses birds to communicate."
131,"The Prancing Pony Bard","Who is the skilled and jovial musician who performs at the Prancing Pony inn in Bree in 'Lord of the Rings'?","Lord Of The Rings","Ulmo","Valinor","The Prancing Pony Bard","Bill the Pony","The Prancing Pony Bard is the musician at the inn."
132,"Bill the Pony","What is the name of the reliable and overlooked pony that carries supplies for the Fellowship in 'Lord of the Rings'?","Lord Of The Rings","Ulmo","Valinor","Bill the Pony","The Watcher in the Water","Bill the Pony is the reliable pony of the Fellowship."
133,"The Watcher in the Water","What mysterious and tentacled creature guards the entrance to the Mines of Moria and attacks the Fellowship in 'Lord of the Rings'?","Lord Of The Rings","Ulmo","Valinor","The Watcher in the Water","The Balrog of Moria","The Watcher guards the entrance to Moria."
134,"The Balrog of Moria","What formidable and fiery demon does Gandalf confront in the depths of Moria in 'Lord of the Rings'?","Lord Of The Rings","Ulmo","Valinor","The Watcher in the Water","The Balrog of Moria","Gandalf confronts the Balrog in Moria."
135,"Gimli's Helmet","Which item of protective headgear does Gimli the Dwarf wear during his adventures in 'Lord of the Rings'?","Lord Of The Rings","Gimli's Helmet","The Horn of Helm Hammerhand","Smeagol's Precious","The Sword of Elendil","Gimli wears a helmet during his adventures."
136,"The Horn of Helm Hammerhand","What powerful horn associated with the King of Rohan is sounded in 'Lord of the Rings' during the Battle of Helm's Deep?","Lord Of The Rings","Gimli's Helmet","The Horn of Helm Hammerhand","Smeagol's Precious","The Sword of Elendil","The Horn of Helm Hammerhand is sounded at Helm's Deep."
137,"Smeagol's Precious","What term does Gollum often use to refer to the One Ring in 'Lord of the Rings'?","Lord Of The Rings","Gimli's Helmet","The Horn of Helm Hammerhand","Smeagol's Precious","The Sword of Elendil","Gollum often calls the One Ring his precious."
138,"The Sword of Elendil","What is the original name of the sword Narsil, which belonged to Isildur and later became Anduril in 'Lord of the Rings'?","Lord Of The Rings","Gimli's Helmet","The Sword of Elendil","The Sword of Isildur","The Sword of Theoden","The Sword of Elendil is the original name of Narsil."
139,"The Sword of Isildur","What is the name of the sword that Isildur used to cut the One Ring from Sauron's finger in 'Lord of the Rings'?","Lord Of The Rings","Gimli's Helmet","The Sword of Elendil","The Sword of Isildur","The Sword of Theoden","The Sword of Isildur cut the One Ring."
140,"The Sword of Theoden","Which sword, reforged from the shards of Narsil, is wielded by King Theoden of Rohan in 'Lord of the Rings'?","Lord Of The Rings","Gimli's Helmet","The Horn of Helm Hammerhand","Smeagol's Precious","The Sword of Theoden","The Sword of Theoden is reforged from Narsil."
141,"The Sword of Eowyn","What weapon does Eowyn use to defeat the Witch-king of Angmar in 'Lord of the Rings'?","Lord Of The Rings","Gimli's Helmet","The Horn of Helm Hammerhand","Smeagol's Precious","The Sword of Eowyn","Eowyn uses the Sword of Eowyn."
142,"The Sword of Aragorn","What is the name of the sword that Aragorn, also known as Strider, wields as the rightful heir to the throne of Gondor in 'Lord of the Rings'?","Lord Of The Rings","Gimli's Helmet","The Horn of Helm Hammerhand","Smeagol's Precious","The Sword of Aragorn","Aragorn wields the Sword of Aragorn."
143,"The Shards of Narsil","What remains of the once-mighty sword Narsil after its breaking in 'Lord of the Rings'?","Lord Of The Rings","Gimli's Helmet","The Shards of Narsil","The Arkenstone","Gandalf's Staff","The Shards of Narsil are what remains of the sword."
144,"The Arkenstone","What is the name of the highly prized and magnificent gem that becomes the subject of conflict in the Lonely Mountain in 'The Hobbit'?","Lord Of The Rings","Gimli's Helmet","The Horn of Helm Hammerhand","Smeagol's Precious","The Arkenstone","The Arkenstone is a highly prized gem."
145,"Gandalf's Staff","What powerful magical staff is wielded by Gandalf the Grey, one of the Istari wizards, in 'Lord of the Rings'?","Lord Of The Rings","Gimli's Helmet","The Horn of Helm Hammerhand","Smeagol's Precious","Gandalf's Staff","Gandalf wields a powerful staff."
146,"Frodo's Mithril Vest","What protective garment made of mithril, a strong and lightweight metal, does Frodo receive as a gift in 'Lord of the Rings'?","Lord Of The Rings","Gimli's Helmet","Frodo's Mithril Vest","Frodo's Elven Rope","Galadriel's Mirror","Frodo receives a Mithril Vest."
147,"Frodo's Elven Rope","What special rope made by the Elves does Frodo carry with him on his journey in 'Lord of the Rings'?","Lord Of The Rings","Gimli's Helmet","Frodo's Mithril Vest","Frodo's Elven Rope","Galadriel's Mirror","Frodo carries an Elven Rope."
148,"Galadriel's Mirror","What mystical and reflective basin does Galadriel use to show Frodo visions of the past, present, and future in 'Lord of the Rings'?","Lord Of The Rings","Gimli's Helmet","Frodo's Mithril Vest","Frodo's Elven Rope","Galadriel's Mirror","Galadriel uses a mystical mirror."
149,"Frodo's Cloak of Invisibility","What magical item, given to Frodo by Galadriel, allows its wearer to become invisible in 'Lord of the Rings'?","Lord Of The Rings","Frodo's Cloak of Invisibility","Arwen's Evenstar Pendant","The Horn of Boromir","The Scroll of Isildur","Frodo's Cloak of Invisibility makes the wearer invisible."
150,"Arwen's Evenstar Pendant","What beautiful and symbolic pendant does Aragorn give to Arwen as a token of his love in 'Lord of the Rings'?","Lord Of The Rings","Frodo's Cloak of Invisibility","Arwen's Evenstar Pendant","The Horn of Boromir","The Scroll of Isildur","Arwen receives an Evenstar Pendant as a token of love."
151,"The Horn of Boromir","What valuable item, carried by Boromir, is blown as a call for aid before his demise in 'Lord of the Rings'?","Lord Of The Rings","Frodo's Cloak of Invisibility","Arwen's Evenstar Pendant","The Horn of Boromir","The Scroll of Isildur","Boromir uses the Horn of Boromir to call for aid."
152,"The Scroll of Isildur","What ancient scroll contains the account of Isildur's defeat of Sauron and the loss of the One Ring in 'Lord of the Rings'?","Lord Of The Rings","Frodo's Cloak of Invisibility","Arwen's Evenstar Pendant","The Horn of Boromir","The Scroll of Isildur contains the account of Isildur's defeat of Sauron."
153,"The Key to Erebor","What item, used by Thorin Oakenshield's company to enter the Lonely Mountain, is instrumental in opening the secret door to Erebor in 'The Hobbit'?","Lord Of The Rings","Frodo's Cloak of Invisibility","Arwen's Evenstar Pendant","The Horn of Boromir","The Key to Erebor is used to open the secret door to Erebor."
154,"The Elendilmir","What is the name of the legendary white gem that once adorned the helm of the Kings of Arnor and later becomes an heirloom of Aragorn in 'Lord of the Rings'?","Lord Of The Rings","Frodo's Cloak of Invisibility","The Elendilmir","The Crown of Gondor","Radagast's Rabbit Sled","The Elendilmir is a white gem of the Kings of Arnor."
155,"The Crown of Gondor","What ceremonial headpiece represents the kingship of Gondor and is used in the coronation of Aragorn as the King of Gondor in 'Lord of the Rings'?","Lord Of The Rings","Frodo's Cloak of Invisibility","The Elendilmir","The Crown of Gondor","Radagast's Rabbit Sled","The Crown of Gondor represents the kingship of Gondor."
156,"Radagast's Rabbit Sled","What unusual and whimsical mode of transportation is used by Radagast the Brown, one of the Istari wizards, in 'Lord of the Rings'?","Lord Of The Rings","Frodo's Cloak of Invisibility","Arwen's Evenstar Pendant","Radagast's Rabbit Sled","Samwise's Cooking Pot","Radagast uses a Rabbit Sled as transportation."
157,"Samwise's Cooking Pot","What practical item is carried by Samwise Gamgee, the loyal companion of Frodo, on their journey in 'Lord of the Rings'?","Lord Of The Rings","Frodo's Cloak of Invisibility","Arwen's Evenstar Pendant","Radagast's Rabbit Sled","Samwise's Cooking Pot is a practical item carried by Sam."
158,"The Palantir of Minas Tirith","What powerful and ancient seeing stone is used by Denethor, the Steward of Gondor, to communicate with other palantíri in 'Lord of the Rings'?","Lord Of The Rings","Frodo's Cloak of Invisibility","Arwen's Evenstar Pendant","Radagast's Rabbit Sled","The Palantir of Minas Tirith is a powerful seeing stone."
159,"Arwen's Evenstar Necklace","What beautiful pendant, representing the Evenstar of her people, is worn by Arwen Undómiel, the daughter of Elrond, in 'Lord of the Rings'?","Lord Of The Rings","Frodo's Cloak of Invisibility","Arwen's Evenstar Necklace","Gimli's Battle Axe","Legolas' Fighting Knives","Arwen wears an Evenstar Necklace."
160,"Gimli's Battle Axe","What formidable weapon is wielded by Gimli the Dwarf throughout his adventures in 'Lord of the Rings'?","Lord Of The Rings","Frodo's Cloak of Invisibility","Arwen's Evenstar Necklace","Gimli's Battle Axe","Legolas' Fighting Knives","Gimli wields a Battle Axe."
161,"Legolas' Fighting Knives","What weapons are frequently used by Legolas, the Elf of the Fellowship, to great effect in 'Lord of the Rings'?","Lord Of The Rings","Frodo's Cloak of Invisibility","Arwen's Evenstar Necklace","Gimli's Battle Axe","Legolas' Fighting Knives","Legolas uses Fighting Knives as weapons."
162,"Saruman's Voice","What power does Saruman, one of the Istari wizards, use to influence and control the minds of others in 'Lord of the Rings'?","Lord Of The Rings","Frodo's Cloak of Invisibility","Arwen's Evenstar Necklace","Gimli's Battle Axe","Saruman's Voice","Saruman uses his voice to influence and control."
163,"Frodo's Orc Disguise","What disguise does Frodo use to infiltrate the orc stronghold of Cirith Ungol in 'Lord of the Rings'?","Lord Of The Rings","Frodo's Cloak of Invisibility","Arwen's Evenstar Necklace","Gimli's Battle Axe","Frodo's Orc Disguise is used for infiltration."
164,"The Bridge of Khazad-dûm","What perilous location in the Mines of Moria becomes the site of a dramatic confrontation with a Balrog in 'Lord of the Rings'?","Lord Of The Rings","Frodo's Cloak of Invisibility","Arwen's Evenstar Necklace","The Bridge of Khazad-dûm","The Paths of the Dead","The Bridge of Khazad-dûm is the site of the confrontation."
165,"The Paths of the Dead","What eerie and haunted passageways in the White Mountains are traversed by Aragorn and the Grey Company in 'Lord of the Rings'?","Lord Of The Rings","Frodo's Cloak of Invisibility","Arwen's Evenstar Necklace","The Bridge of Khazad-dûm","The Paths of the Dead are eerie passageways."
166,"Oin","Which member of Thorin Oakenshield's company of Dwarves is known for his expertise as a fire-maker and for his hearing aid device in 'The Hobbit'?","Lord Of The Rings","Oin","Nori","Dori","Frodo's Phial of Galadriel","Oin is known for fire-making and his hearing aid device."
167,"Nori","Among Thorin Oakenshield's company of Dwarves, which one is characterized by his love of mischief and has a reputation for being a thief in 'The Hobbit'?","Lord Of The Rings","Oin","Nori","Dori","Frodo's Phial of Galadriel","Nori is known for mischief and thieving."
168,"Dori","Which Dwarf from Thorin Oakenshield's company is known for his strong sense of responsibility and takes care of the other Dwarves in 'The Hobbit'?","Lord Of The Rings","Oin","Nori","Dori","Frodo's Phial of Galadriel","Dori is responsible and cares for the Dwarves."
169,"Frodo's Phial of Galadriel","What source of light does Frodo use in the dark passages of Shelob's Lair in 'Lord of the Rings'?","Lord Of The Rings","Oin","Nori","Dori","Frodo's Phial of Galadriel","Frodo uses Galadriel's Phial as a source of light."
170,"Galadriel's Rope","What magical rope, given to Sam and Frodo by Galadriel, helps them descend into the abyss of Cirith Ungol in 'Lord of the Rings'?","Lord Of The Rings","Oin","Nori","Dori","Galadriel's Rope","Galadriel's Rope helps them descend."
171,"The Mirror of Galadriel","What mystical object does Galadriel use to show Frodo and Sam visions of past, present, and future events in 'Lord of the Rings'?","Lord Of The Rings","Oin","Nori","Dori","The Mirror of Galadriel","Galadriel uses the Mirror of Galadriel."
172,"Treebeard's Ent-draught","What rejuvenating drink, offered to Merry and Pippin by Treebeard the Ent, causes them to grow taller and stronger in 'Lord of the Rings'?","Lord Of The Rings","Oin","Nori","Dori","Treebeard's Ent-draught","Treebeard offers them an Ent-draught."
173,"Barrow-wights","What malevolent spirits or creatures attack Frodo, Sam, Merry, and Pippin in the Barrow-downs in 'Lord of the Rings'?","Lord Of The Rings","Oin","Nori","Dori","Barrow-wights attack them in the Barrow-downs."
174,"The Battle of Five Armies","What significant conflict involving Dwarves, Elves, Men, and Goblins takes place near the Lonely Mountain in 'The Hobbit'?","Lord Of The Rings","Oin","Nori","Dori","The Battle of Five Armies takes place near the Lonely Mountain."
175,"Thorin Oakenshield","Who is the leader of the company of Dwarves on a quest to reclaim the Lonely Mountain and its treasure in 'The Hobbit'?","Lord Of The Rings","Oin","Nori","Dori","Thorin Oakenshield leads the Dwarves."
176,"Bard the Bowman","Which skilled archer and warrior plays a crucial role in the Battle of the Five Armies by defeating Smaug in 'The Hobbit'?","Lord Of The Rings","Oin","Nori","Dori","Bard the Bowman defeats Smaug."
177,"Beorn's Skin-changing","What unique ability does Beorn, a shape-shifter who aids the Dwarves in 'The Hobbit,' possess that allows him to transform into a bear and back into a man?","Lord Of The Rings","Oin","Nori","Dori","Beorn has the ability of skin-changing."
178,"The Hobbit","Which novel by J.R.R. Tolkien serves as a prequel to 'The Lord of the Rings' and tells the story of Bilbo Baggins' adventures with a group of Dwarves?","Lord Of The Rings","The Hobbit","Durin IV","Thrain II","Dáin Ironfoot","'The Hobbit' serves as a prequel to 'The Lord of the Rings.'"
179,"Durin IV","What Dwarf King of Khazad-dûm ruled during the time of Smaug's attack on Erebor in 'The Hobbit'?","Lord Of The Rings","The Hobbit","Durin IV","Thrain II","Dáin Ironfoot","Durin IV ruled during that time."
180,"Thrain II","Which Dwarf, Thorin Oakenshield's father, was imprisoned by the Necromancer in Dol Guldur before he went missing in 'The Hobbit'?","Lord Of The Rings","The Hobbit","Durin IV","Thrain II","Dáin Ironfoot","Thrain II was imprisoned and went missing."
181,"Dáin Ironfoot","Who becomes the King under the Mountain and ruler of Erebor after the death of Thorin Oakenshield in 'The Hobbit'?","Lord Of The Rings","The Hobbit","Durin IV","Thrain II","Dáin Ironfoot","Dáin Ironfoot becomes the ruler of Erebor."
182,"Thranduil's Crown","What valuable treasure does Thranduil, the Elven King of Mirkwood, demand as a share of the treasure from Thorin's company in 'The Hobbit'?","Lord Of The Rings","The Hobbit","Thranduil's Crown","Smaug the Dragon","The Arkenstone","Thranduil demands a share, including his crown."
183,"Smaug the Dragon","What fearsome and treasure-hoarding creature is the primary antagonist of 'The Hobbit'?","Lord Of The Rings","The Hobbit","Smaug the Dragon","The Battle of Azanulbizar","The Great Goblin","Smaug is the primary antagonist."
184,"The Battle of Azanulbizar","What significant conflict between Dwarves and Orcs, led by Azog the Defiler, takes place in the northern part of the Misty Mountains in 'The Hobbit'?","Lord Of The Rings","The Hobbit","The Battle of Azanulbizar","The Great Goblin","Bolg","The Battle of Azanulbizar occurs."
185,"The Great Goblin","What grotesque and powerful Goblin is the ruler of the Goblin-town in the Misty Mountains in 'The Hobbit'?","Lord Of The Rings","The Hobbit","The Battle of Azanulbizar","The Great Goblin","Bolg","The Great Goblin rules Goblin-town."
186,"Bolg","Who is the son of Azog the Defiler and takes command of the Orcs after Azog's death in 'The Hobbit'?","Lord Of The Rings","The Hobbit","The Battle of Azanulbizar","The Great Goblin","Bolg","Bolg takes command after Azog's death."
187,"Dale","What city, situated near the Lonely Mountain, is rebuilt and becomes prosperous after the defeat of Smaug in 'The Hobbit'?","Lord Of The Rings","The Hobbit","Dale","Erebor","The Battle of Dale","Dale becomes prosperous after Smaug's defeat."
188,"Erebor","What ancient Dwarf kingdom, also known as the Lonely Mountain, is home to a vast treasure and becomes the focus of the quest in 'The Hobbit'?","Lord Of The Rings","The Hobbit","Dale","Erebor","The Arkenstone","Erebor is the Lonely Mountain."
189,"The Battle of Dale","What climactic battle takes place in the vicinity of Dale as part of the conflict involving the Men of Dale, Elves, Dwarves, and Orcs in 'The Hobbit'?","Lord Of The Rings","The Hobbit","Dale","Erebor","The Battle of Dale is a significant battle."
190,"The Arkenstone","What priceless gem, sought after by Thorin Oakenshield, becomes a source of conflict and represents the heart of the treasure in Erebor in 'The Hobbit'?","Lord Of The Rings","The Hobbit","Dale","Erebor","The Arkenstone represents the treasure's heart."
191,"Radagast's Brown Birds","What creatures does Radagast the Brown use to send messages and gather information in 'Lord of the Rings'?","Lord Of The Rings","Radagast's Brown Birds","Thrain's Map","The Council of Elrond","The Last Alliance of Elves and Men","Radagast uses Brown Birds."
192,"Thrain's Map","What artifact, belonging to Thorin Oakenshield's father, provides crucial information about the Lonely Mountain and its secret entrance in 'The Hobbit'?","Lord Of The Rings","Radagast's Brown Birds","Thrain's Map","The Council of Elrond","Thrain's Map provides crucial information."
193,"The Council of Elrond","In which gathering of Free Peoples of Middle-earth is the fate of the One Ring decided, leading to the formation of the Fellowship of the Ring in 'Lord of the Rings'?","Lord Of The Rings","Radagast's Brown Birds","Thrain's Map","The Council of Elrond","The Council of Elrond decides the Ring's fate."
