"uid","answer","question","subject","option1","option2","option3","option4","explanation"
194,"The Last Alliance of Elves and Men","What historic alliance was formed between Elves and Men to combat the Dark Lord Sauron at the end of the Second Age in 'Lord of the Rings'?","Lord Of The Rings","Radagast's Brown Birds","Thrain's Map","The Last Alliance of Elves and Men","The Last Alliance fought against Sauron."
195,"The Watcher in the Water","What mysterious and tentacled creature guards the entrance to the Mines of Moria, attacking the Fellowship in 'Lord of the Rings'?","Lord Of The Rings","The Watcher in the Water","The Ford of Bruinen","The Barrow-downs","The Watcher guards the Moria entrance."
196,"The Ford of Bruinen","Where does Arwen, with the help of a flood, confront the pursuing Nazgûl to protect Frodo in 'Lord of the Rings'?","Lord Of The Rings","The Watcher in the Water","The Ford of Bruinen","The Ford of Bruinen is where Arwen confronts the Nazgûl."
197,"The Barrow-downs","What eerie and ancient burial mounds pose a danger to Frodo and his companions as they journey through the Old Forest in 'Lord of the Rings'?","Lord Of The Rings","The Watcher in the Water","The Ford of Bruinen","The Barrow-downs","The Barrow-downs are ancient burial mounds."
198,"The Tower of Cirith Ungol","In which sinister tower of Mordor is Frodo briefly held captive before his rescue by Sam in 'Lord of the Rings'?","Lord Of The Rings","The Watcher in the Water","The Ford of Bruinen","The Tower of Cirith Ungol is where Frodo is held captive."
199,"The Dead Men of Dunharrow","What spectral army, bound by an ancient oath to fight for Gondor, aids Aragorn in the Battle of Pelennor Fields in 'Lord of the Rings'?","Lord Of The Rings","The Watcher in the Water","The Ford of Bruinen","The Dead Men of Dunharrow aid Aragorn."
200,"The White Council","What council of powerful beings, including wizards and Elves, forms to oppose the growing power of Sauron in 'Lord of the Rings'?","Lord Of The Rings","The Watcher in the Water","The Ford of Bruinen","The White Council opposes Sauron."
201,"The Battle of the Pelennor Fields","In what major battle of the War of the Ring does the combined forces of Gondor and Rohan face the armies of Mordor, including the Witch-king of Angmar in 'Lord of the Rings'?","Lord Of The Rings","The Battle of the Pelennor Fields","The Battle of the Black Gate","The Battle of Bywater","The Battle of the Pelennor Fields is a significant battle."
202,"The Battle of the Black Gate","What climactic battle takes place at the very gates of Mordor, where the forces of good confront Sauron's armies in 'Lord of the Rings'?","Lord Of The Rings","The Battle of the Pelennor Fields","The Battle of the Black Gate","The Battle of Bywater","The Battle of the Black Gate is a climactic battle."
203,"The Battle of Bywater","In which final conflict of the War of the Ring do Hobbits, led by Merry and Pippin, face and defeat the ruffians who have taken control of the Shire in 'Lord of the Rings'?","Lord Of The Rings","The Battle of the Pelennor Fields","The Battle of the Black Gate","The Battle of Bywater is the final conflict."
204,"The Scouring of the Shire","What event in 'Lord of the Rings' involves the Hobbits returning home to find the Shire under the control of a malicious overseer named Lotho Sackville-Baggins and his men?","Lord Of The Rings","The Scouring of the Shire","The War of the Ring","The Battle of Bywater","The Scouring of the Shire is when the Hobbits return."
205,"The War of the Ring","What is the overarching conflict between the forces of good, led by the Free Peoples of Middle-earth, and the forces of evil, led by Sauron and his allies, in 'Lord of the Rings'?","Lord Of The Rings","The Scouring of the Shire","The War of the Ring","The Battle of Bywater","The War of the Ring is the overarching conflict."
206,"The Battle of Azanulbizar","What significant battle takes place between Dwarves and Orcs in the northern part of the Misty Mountains, where Thorin Oakenshield's grandfather Thror was killed, in 'Lord of the Rings'?","Lord Of The Rings","The Battle of Azanulbizar","The Battle of Five Armies","The Great Smials","Brandy Hall","The Battle of Azanulbizar is a significant battle."
207,"The Battle of Five Armies","What battle, involving Dwarves, Men, Elves, Orcs, and Eagles, takes place at the Lonely Mountain in 'The Hobbit'?","Lord Of The Rings","The Battle of Azanulbizar","The Battle of Five Armies","The Great Smials","Brandy Hall","The Battle of Five Armies involves multiple factions."
208,"The Great Smials","What is the name of one of the two main residences of the prominent Took family in the Shire, known for their adventurous spirit, in 'Lord of the Rings'?","Lord Of The Rings","The Battle of Azanulbizar","The Battle of Five Armies","The Great Smials","Brandy Hall","The Great Smials is a Took residence."
209,"Brandy Hall","What is the name of one of the main residences of the Brandybuck family, one of the wealthiest and most influential families in the Shire, in 'Lord of the Rings'?","Lord Of The Rings","The Battle of Azanulbizar","The Battle of Five Armies","The Great Smials","Brandy Hall is a Brandybuck residence."
210,"Tuckborough","Which village in the Westfarthing of the Shire is known for its picturesque location near the Brandywine River and is home to the Tooks and the Great Smials in 'Lord of the Rings'?","Lord Of The Rings","The Battle of Azanulbizar","The Battle of Five Armies","The Great Smials","Tuckborough is near the Brandywine River."
211,"Michel Delving","What is the chief town and capital of the Shire, known for its imposing white stone buildings and the Mayor's Residence, in 'Lord of the Rings'?","Lord Of The Rings","The Battle of Azanulbizar","The Battle of Five Armies","The Great Smials","Michel Delving is the Shire's capital."
212,"The Sackville-Bagginses","Which family, known for their greed and desire to take over Bag End, is related to the Bagginses and causes trouble for Frodo in 'Lord of the Rings'?","Lord Of The Rings","The Battle of Azanulbizar","The Battle of Five Armies","The Great Smials","The Sackville-Bagginses are troublemakers."
213,"The Hornburg","What is the name of the fortress of Rohan, also known as Helm's Deep, which serves as a stronghold against the forces of Saruman and later Sauron in 'Lord of the Rings'?","Lord Of The Rings","The Battle of Azanulbizar","The Battle of Five Armies","The Great Smials","The Hornburg is a fortress of Rohan."
214,"Frodo's Barrow-wight Encounter","In 'Lord of the Rings,' what eerie and dangerous encounter do Frodo and his companions experience in the Barrow-downs, where they are captured by malevolent spirits and later rescued by Tom Bombadil?","Lord Of The Rings","The Battle of Azanulbizar","The Battle of Five Armies","The Great Smials","Frodo's Barrow-wight encounter is a perilous event."
215,"The Entmoot","What is the name of the gathering of Ents, the ancient tree-like beings of Fangorn Forest, where they discuss whether to go to war in 'Lord of the Rings'?","Lord Of The Rings","The Battle of Azanulbizar","The Battle of Five Armies","The Great Smials","The Entmoot is where Ents make decisions."
216,"The Battle of the Hornburg","What is the name of the epic battle that takes place at the fortress of Helm's Deep in 'Lord of the Rings,' where the people of Rohan face a massive Uruk-hai assault?","Lord Of The Rings","The Battle of Azanulbizar","The Battle of Five Armies","The Great Smials","The Battle of the Hornburg is a significant battle."
217,"The Palantir of Orthanc","What powerful and ancient seeing-stone, used by Saruman the White, is kept in the tower of Orthanc in Isengard in 'Lord of the Rings'?","Lord Of The Rings","The Battle of Azanulbizar","The Battle of Five Armies","The Great Smials","The Palantir of Orthanc is a potent artifact."
218,"The Siege of Gondor","What pivotal event in 'Lord of the Rings' involves the city of Gondor facing a massive assault by the forces of Mordor, including the Witch-king of Angmar, during the War of the Ring?","Lord Of The Rings","The Battle of Azanulbizar","The Battle of Five Armies","The Great Smials","The Siege of Gondor is a crucial event."
219,"The Battle of Helm's Deep","What epic battle occurs at the fortress of Helm's Deep in 'Lord of the Rings,' where the people of Rohan, led by King Théoden, withstand the assault of Saruman's Uruk-hai forces?","Lord Of The Rings","The Battle of Azanulbizar","The Battle of Five Armies","The Great Smials","The Battle of Helm's Deep is a major conflict."
220,"The Destruction of Isengard","What event in 'Lord of the Rings' involves the flooding of the Ents and the destruction of the fortress of Isengard, breaking Saruman's power and leading to his eventual downfall?","Lord Of The Rings","The Destruction of Isengard","The Siege of Minas Tirith","The Witch-king of Angmar","The Battle of the Pelennor Fields","The Destruction of Isengard is a significant event."
221,"The Siege of Minas Tirith","What critical battle and siege takes place in 'Lord of the Rings,' where the forces of Gondor and Rohan defend the city of Minas Tirith against the overwhelming might of Sauron's armies?","Lord Of The Rings","The Destruction of Isengard","The Siege of Minas Tirith","The Witch-king of Angmar","The Battle of the Pelennor Fields","The Siege of Minas Tirith is a crucial battle."
222,"The Witch-king of Angmar","Who is the leader of the Nazgûl, known for his menacing presence and role in the fall of King Théoden during the Battle of the Pelennor Fields in 'Lord of the Rings'?","Lord Of The Rings","The Destruction of Isengard","The Siege of Minas Tirith","The Witch-king of Angmar","The Witch-king is a menacing leader."
223,"The Battle of the Pelennor Fields","In what pivotal battle of 'Lord of the Rings' does the combined forces of Gondor and Rohan confront Sauron's armies, including the Witch-king, on the fields outside of Minas Tirith?","Lord Of The Rings","The Destruction of Isengard","The Siege of Minas Tirith","The Witch-king of Angmar","The Battle of the Pelennor Fields is a crucial battle."
224,"The Ride of the Rohirrim","What heroic and stirring charge by the Riders of Rohan, led by King Théoden, occurs during the Battle of the Pelennor Fields in 'Lord of the Rings'?","Lord Of The Rings","The Destruction of Isengard","The Siege of Minas Tirith","The Witch-king of Angmar","The Battle of the Pelennor Fields","The Ride of the Rohirrim is a heroic charge."
225,"The Fall of the Witch-king","In 'Lord of the Rings,' how does the Witch-king of Angmar meet his end during the Battle of the Pelennor Fields?","Lord Of The Rings","The Destruction of Isengard","The Siege of Minas Tirith","The Witch-king of Angmar","The Fall of the Witch-king marks his end."
226,"The Battle of the Black Gate","What climactic battle takes place at the very gates of Mordor, where the forces of good confront Sauron's armies in 'Lord of the Rings'?","Lord Of The Rings","The Destruction of Isengard","The Siege of Minas Tirith","The Witch-king of Angmar","The Battle of the Black Gate is a climactic battle."
227,"The Fall of Sauron","In 'Lord of the Rings,' what event marks the ultimate defeat of Sauron and the destruction of the One Ring, leading to the downfall of the Dark Lord and the end of the War of the Ring?","Lord Of The Rings","The Destruction of Isengard","The Siege of Minas Tirith","The Witch-king of Angmar","The Fall of Sauron marks his defeat."
228,"The Scouring of the Shire","What event in 'Lord of the Rings' involves the Hobbits returning to the Shire, only to find it under the control of a malicious overseer named Lotho Sackville-Baggins and his men, and they must take action to liberate their homeland?","Lord Of The Rings","The Destruction of Isengard","The Siege of Minas Tirith","The Witch-king of Angmar","The Scouring of the Shire is a significant event."
229,"The End of All Things","What chapter in 'Lord of the Rings' is named 'The End of All Things,' where Sam and Frodo face their greatest trials and challenges, including the destruction of the One Ring?","Lord Of The Rings","The Destruction of Isengard","The Siege of Minas Tirith","The Witch-king of Angmar","The End of All Things is a pivotal chapter."
230,"The Return of the King","What is the title of the final volume of 'The Lord of the Rings,' signifying the return of Aragorn to the throne of Gondor and the restoration of peace and order in Middle-earth?","Lord Of The Rings","The Destruction of Isengard","The Siege of Minas Tirith","The Witch-king of Angmar","The Return of the King signifies Aragorn's return."
231,"The Grey Havens","Where do Frodo, Gandalf, Bilbo, and many Elves depart to from the shores of Middle-earth at the end of 'The Lord of the Rings,' leaving behind their mortal lives and sailing to a land across the sea?","Lord Of The Rings","The Destruction of Isengard","The Siege of Minas Tirith","The Witch-king of Angmar","The Grey Havens is the departing place."
232,"The Departure of Frodo","What event in 'The Lord of the Rings' involves Frodo leaving Middle-earth with Gandalf, Bilbo, and the Elves on a ship bound for the Grey Havens, marking his departure from the Shire and his friends?","Lord Of The Rings","The Destruction of Isengard","The Siege of Minas Tirith","The Witch-king of Angmar","The Departure of Frodo is a significant departure."
233,"The Red Book of Westmarch","What is the name of the book that contains Bilbo and Frodo's account of their adventures, including 'The Hobbit' and 'The Lord of the Rings,' compiled by Frodo and later completed by Samwise Gamgee?","Lord Of The Rings","The Destruction of Isengard","The Siege of Minas Tirith","The Witch-king of Angmar","The Red Book of Westmarch contains their account."
234,"The Shire Reckoning","What is the name of the calendar and dating system used in the Shire, based on the year of Bilbo's departure from the Shire in 'The Lord of the Rings'?","Lord Of The Rings","The Destruction of Isengard","The Siege of Minas Tirith","The Witch-king of Angmar","The Shire Reckoning is their calendar."
235,"The Great Smials","What is the name of one of the two main residences of the prominent Took family in the Shire, known for their adventurous spirit, in 'Lord of the Rings'?","Lord Of The Rings","The Destruction of Isengard","The Siege of Minas Tirith","The Witch-king of Angmar","The Great Smials is a Took residence."
236,"Brandy Hall","In 'The Lord of the Rings,' which location is known as the main residence of the Brandybuck family, a prominent Hobbit family in the Shire?","Lord Of The Rings","Brandy Hall","The Old Forest","The Barrow-downs","The Bucklebury Ferry","Brandy Hall is a prominent location in the Shire."
237,"The Old Forest","Which forest in 'The Lord of the Rings' is described as ancient, mysterious, and potentially dangerous, home to Tom Bombadil and the site of Frodo and his companions' encounter with Old Man Willow?","Lord Of The Rings","The Old Forest","The Barrow-downs","The Bucklebury Ferry","Tom Bombadil's House","The Old Forest is a significant location in the story."
238,"The Barrow-downs","In 'The Lord of the Rings,' what eerie and ancient burial mounds are encountered by Frodo and his companions on their journey through the Shire, and they are linked to the history of the Dunedain?","Lord Of The Rings","The Barrow-downs","The Old Forest","The Bucklebury Ferry","Tom Bombadil's House","The Barrow-downs are a mysterious location."
239,"The Bucklebury Ferry","What is the name of the ferry that Frodo, Sam, Merry, and Pippin use to cross the Brandywine River on their journey out of the Shire in 'The Lord of the Rings'?","Lord Of The Rings","The Bucklebury Ferry","The Old Forest","The Barrow-downs","Tom Bombadil's House","The Bucklebury Ferry is used for their crossing."
240,"Tom Bombadil's House","In 'The Lord of the Rings,' what is the name of the home of the enigmatic character Tom Bombadil, where Frodo and his companions find refuge and assistance during their journey through the Old Forest?","Lord Of The Rings","Tom Bombadil's House","The Old Forest","The Barrow-downs","The Bucklebury Ferry","Tom Bombadil's House is a unique location."
241,"The Brandywine River","What is the name of the river that marks the western boundary of the Shire in 'The Lord of the Rings,' and it is crossed by Frodo and his companions on their way to Bree?","Lord Of The Rings","The Brandywine River","The Tower of Cirith Ungol","The Morgul Vale","The Land of Shadow","The Brandywine River is a significant boundary."
242,"The Tower of Cirith Ungol","In 'The Lord of the Rings,' what is the name of the tower located in Mordor, where Frodo and Sam are captured and Frodo is temporarily held captive before being rescued by Sam?","Lord Of The Rings","The Tower of Cirith Ungol","The Morgul Vale","The Land of Shadow","The Field of Cormallen","The Tower of Cirith Ungol is a perilous location."
243,"The Morgul Vale","What sinister location in 'The Lord of the Rings' is associated with the Nazgûl and is the setting for Frodo's encounter with the Witch-king and his confrontation with Shelob?","Lord Of The Rings","The Morgul Vale","The Tower of Cirith Ungol","The Land of Shadow","The Field of Cormallen","The Morgul Vale is a dangerous place in Mordor."
244,"The Land of Shadow","In 'The Lord of the Rings,' what is the name of the region in Mordor where Mount Doom is located, and it serves as the final destination of Frodo and Sam on their quest to destroy the One Ring?","Lord Of The Rings","The Land of Shadow","The Morgul Vale","The Tower of Cirith Ungol","The Field of Cormallen","The Land of Shadow is a pivotal location."
245,"The Field of Cormallen","In 'The Lord of the Rings,' what is the name of the location where Frodo and Sam are honored by the Free Peoples of Middle-earth after the defeat of Sauron, and Frodo is crowned with a special wreath?","Lord Of The Rings","The Field of Cormallen","The Steward and the King","The Scouring of the Shire","The Grey Havens","The Field of Cormallen is a place of celebration."
246,"The Steward and the King","What chapter in 'The Lord of the Rings' details the return of Aragorn to Gondor, his reunification with Arwen, and his eventual coronation as King of Gondor and Arnor?","Lord Of The Rings","The Steward and the King","The Scouring of the Shire","The Grey Havens","The Land of Shadow","The Steward and the King is a pivotal chapter."
247,"The Scouring of the Shire","What event in 'The Lord of the Rings' involves the Hobbits returning to the Shire, only to find it under the control of a malicious overseer named Lotho Sackville-Baggins and his men, and they must take action to liberate their homeland?","Lord Of The Rings","The Scouring of the Shire","The Grey Havens","The Steward and the King","The Field of Cormallen","The Scouring of the Shire is a significant event."
248,"The Grey Havens","Where do Frodo, Gandalf, Bilbo, and many Elves depart to from the shores of Middle-earth at the end of 'The Lord of the Rings,' leaving behind their mortal lives and sailing to a land across the sea?","Lord Of The Rings","The Grey Havens","The Steward and the King","The Scouring of the Shire","The Field of Cormallen","The Grey Havens is the departing place."
249,"The Last of the Noldor","In 'The Lord of the Rings,' which chapter is primarily about the departure of the Elves from Middle-earth, marking the end of their presence in the land?","Lord Of The Rings","The Last of the Noldor","Elendil's Sword","Isildur's Bane","The Last Debate","'The Last of the Noldor' is a significant chapter."
250,"Elendil's Sword","What is the name of the sword that Aragorn wields, which originally belonged to Elendil, and it is reforged by the Elves and used by Aragorn as the symbol of his claim to the throne of Gondor?","Lord Of The Rings","Elendil's Sword","Isildur's Bane","The Last Debate","The Field of Cormallen","'Elendil's Sword' is an important weapon."
251,"Isildur's Bane","In 'The Lord of the Rings,' what term is used to refer to the One Ring, especially in the context of its corrupting influence and its ability to control those who possess it?","Lord Of The Rings","Isildur's Bane","Elendil's Sword","The Last Debate","The Field of Cormallen","'Isildur's Bane' is a significant concept."
252,"The Last Debate","Which chapter in 'The Lord of the Rings' depicts a discussion among the leaders of the Free Peoples of Middle-earth as they decide how to address the threat of Sauron and his armies before the final battle?","Lord Of The Rings","The Last Debate","Elendil's Sword","Isildur's Bane","The Field of Cormallen","'The Last Debate' is a pivotal chapter."
253,"The Field of Cormallen","In 'The Lord of the Rings,' what is the name of the location where the victorious Free Peoples of Middle-earth gather to celebrate their victory over Sauron and his forces following the Battle of the Morannon?","Lord Of The Rings","The Field of Cormallen","The Steward and the King","Many Partings","Homeward Bound","'The Field of Cormallen' is a joyful place."
254,"The Steward and the King","What chapter in 'The Lord of the Rings' describes Aragorn's return to Gondor, his reunion with Arwen, and his coronation as King Elessar Telcontar?","Lord Of The Rings","The Steward and the King","Many Partings","Homeward Bound","The Scouring of the Shire","'The Steward and the King' is a momentous chapter."
255,"Many Partings","In 'The Lord of the Rings,' which chapter focuses on the farewells and departures of various characters as they go their separate ways after the defeat of Sauron?","Lord Of The Rings","Many Partings","Homeward Bound","The Scouring of the Shire","The Grey Havens","'Many Partings' is a chapter of farewells."
256,"Homeward Bound","What chapter in 'The Lord of the Rings' describes the journey of the Hobbits as they return to the Shire after their adventures, only to find it changed and in need of their intervention?","Lord Of The Rings","Homeward Bound","The Scouring of the Shire","The Grey Havens","The Last of the Noldor","'Homeward Bound' is a significant chapter."
257,"The Scouring of the Shire","In 'The Lord of the Rings,' what event involves the Hobbits returning to the Shire, only to discover that it has been taken over by ruffians and corrupted by the influence of Lotho Sackville-Baggins and Saruman?","Lord Of The Rings","The Scouring of the Shire","The Grey Havens","The Last of the Noldor","Elendil's Sword","'The Scouring of the Shire' is a pivotal event."
258,"The Grey Havens","Where do Frodo, Gandalf, Bilbo, and many Elves depart to from the shores of Middle-earth at the end of 'The Lord of the Rings,' leaving behind their mortal lives and sailing to a land across the sea?","Lord Of The Rings","The Grey Havens","The Last of the Noldor","Elendil's Sword","Isildur's Bane","'The Grey Havens' is the departing place."
259,"The Last of the Noldor","In 'The Lord of the Rings,' which chapter is primarily about the departure of the Elves from Middle-earth, marking the end of their presence in the land?","Lord Of The Rings","The Last of the Noldor","Elendil's Sword","Isildur's Bane","The Last Debate","'The Last of the Noldor' is a significant chapter."
260,"Elendil's Sword","What is the name of the sword that Aragorn wields, which originally belonged to Elendil, and it is reforged by the Elves and used by Aragorn as the symbol of his claim to the throne of Gondor?","Lord Of The Rings","Elendil's Sword","Isildur's Bane","The Last Debate","The Field of Cormallen","'Elendil's Sword' is an important weapon."
261,"Isildur's Bane","In 'The Lord of the Rings,' what term is used to refer to the One Ring, especially in the context of its corrupting influence and its ability to control those who possess it?","Lord Of The Rings","Isildur's Bane","Elendil's Sword","The Last Debate","The Field of Cormallen","'Isildur's Bane' is a significant concept."
262,"The Last Debate","Which chapter in 'The Lord of the Rings' depicts a discussion among the leaders of the Free Peoples of Middle-earth as they decide how to address the threat of Sauron and his armies before the final battle?","Lord Of The Rings","The Last Debate","Elendil's Sword","Isildur's Bane","The Field of Cormallen","'The Last Debate' is a pivotal chapter."
263,"The Field of Cormallen","In 'The Lord of the Rings,' what is the name of the location where the victorious Free Peoples of Middle-earth gather to celebrate their victory over Sauron and his forces following the Battle of the Morannon?","Lord Of The Rings","The Field of Cormallen","The Steward and the King","Many Partings","Homeward Bound","'The Field of Cormallen' is a joyful place."
264,"The Steward and the King","What chapter in 'The Lord of the Rings' describes Aragorn's return to Gondor, his reunion with Arwen, and his coronation as King Elessar Telcontar?","Lord Of The Rings","The Steward and the King","Many Partings","Homeward Bound","The Scouring of the Shire","'The Steward and the King' is a momentous chapter."
265,"Many Partings","In 'The Lord of the Rings,' which chapter focuses on the farewells and departures of various characters as they go their separate ways after the defeat of Sauron?","Lord Of The Rings","Many Partings","Homeward Bound","The Scouring of the Shire","The Grey Havens","'Many Partings' is a chapter of farewells."
266,"Homeward Bound","What chapter in 'The Lord of the Rings' describes the journey of the Hobbits as they return to the Shire after their adventures, only to find it changed and in need of their intervention?","Lord Of The Rings","Homeward Bound","The Scouring of the Shire","The Grey Havens","The Last of the Noldor","'Homeward Bound' is a significant chapter."
