"answer","question","subject","option1","option2","option3","option4","explanation"
"Anduril","What is the name of the reforged sword from the shards of Narsil, carried by Aragorn as the King of Gondor?","Lord Of The Rings","Ulmo","Valinor","Narsil","Anduril","Anduril is the reforged sword carried by Aragorn."
"Anórien","What is the name of the region of Gondor that lies east of the White Mountains and is known for its fertile plains and farmlands?","Lord Of The Rings","Anórien","Battle of Pelennor","Beregond","Bill Ferny","Anórien is a prominent Gondorian region."
"Aragorn","Which character is also known as Strider?","Lord Of The Rings","Frodo Baggins","Aragorn","Gandalf","Legolas","Aragorn is also known as Strider in the story."
"The Sword of Aragorn","What is the name of the sword that Aragorn, also known as Strider, wields as the rightful heir to the throne of Gondor?","Lord Of The Rings","Gimli's Helmet","The Horn of Helm Hammerhand","Smeagol's Precious","The Sword of Aragorn","Aragorn wields the Sword of Aragorn."
"Arwen","Who is the half-elf princess of Rivendell and the love interest of Aragorn?","Lord Of The Rings","Elendil","Arwen","Frodo's Journal","Smeagol","Arwen is the half-elf princess and Aragorn's love interest."
"Evenstar Necklace","What beautiful and symbolic pendant does Aragorn give to Arwen as a token of his love?","Lord Of The Rings","Cloak of Invisibility","Evenstar Pendant","The Horn of Boromir","The Scroll of Isildur","Arwen receives an Evenstar Pendant as a token of love."
"Aulë","Which Valar is known as the Smith and the creator of the Dwarves in 'The Silmarillion'?","Lord Of The Rings","Aulë","Glóin","Bifur","Manwe","Aulë is known as the Smith and creator of the Dwarves in 'The Silmarillion.'"
"Manwe","Who is the King of the Valar and the chief of the Ainur in 'The Silmarillion'?","Lord Of The Rings","Aulë","Glóin","Bifur","Manwe","Manwe is the King of the Valar in 'The Silmarillion.'"
"Bag End","What is the name of Bilbo and Frodo Baggins' residence in the Shire?","Lord Of The Rings","Rivendell","Bag End","Hobbiton","Minas Tirith","Bag End is the residence of Bilbo and Frodo Baggins."
"Barad-dûr","What is the name of Sauron's dark fortress?","Lord Of The Rings","Rivendell","Mordor","Minas Tirith","Hobbiton","Barad-dûr is Sauron's dark fortress."
"Beorn","Who is the shape-shifting and reclusive skin-changer encountered by Bilbo and the dwarves?","Lord Of The Rings","Beorn","Grima Wormtongue","Eowyn's Shieldmaiden Armor","The Mouth of Sauron","Beorn is the shape-shifting skin-changer encountered."
"Beregond","Who is a loyal soldier and guard of Minas Tirith, and he becomes a trusted friend of Pippin Took, even saving Faramir's life during the battle?","Lord Of The Rings","Beregond","Bill Ferny","Bree","Buckland","Beregond is a valiant character in Gondor."
"Bifur","Which dwarf from Thorin Oakenshield's company shares a similar name with his cousins Bofur and Bombur?","Lord Of The Rings","The Prancing Pony Innkeeper","Glóin","Bifur","Bofur","Bifur shares a similar name with his cousins."
"Bilbo Baggins","Which hobbit is known for his long life and adventure with the dwarves and later passes the One Ring to Frodo?","Lord Of The Rings","Boromir","Theoden","Shelob","Gondor","Bilbo Baggins is known for his adventures and passing the One Ring to Frodo."
"Bill Ferny","What is the name of a disreputable character in 'The Lord of the Rings' who is involved in shady dealings and has a brief encounter with Frodo and the other Hobbits in Bree?","Lord Of The Rings","Bill Ferny","Bree","Buckland","Dagorlad","Bill Ferny is known for his unsavory actions."
"Bill the Pony","What is the name of the reliable and overlooked pony that carries supplies for the Fellowship?","Lord Of The Rings","Ulmo","Valinor","Bill the Pony","The Watcher in the Water","Bill the Pony is the reliable pony of the Fellowship."
"Bofur","Which dwarf from Thorin Oakenshield's company shares a similar name with his cousins Bifur and Bombur?","Lord Of The Rings","The Prancing Pony Innkeeper","Glóin","Bifur","Bofur","Bofur shares a similar name with his cousins."
"Bolg","Who is the son of Azog the Defiler and takes command of the Orcs after Azog's death?","Lord Of The Rings","Bolg","Goblin King","Azog Jr.","Orc Leader","Bolg is the son of Azog the Defiler and takes command of the Orcs after Azog's death."
"Boromir","Which member of the Fellowship of the Ring hails from the city of Gondor?","Lord Of The Rings","Theoden","Shelob","Gondor","Boromir","Boromir is from the city of Gondor."
"The Horn of Boromir","What valuable item, carried by Boromir, is blown as a call for aid before his demise?","Lord Of The Rings","Cloak of Invisibility","Evenstar Pendant","The Horn of Boromir","The Scroll of Isildur","Boromir uses the Horn of Boromir to call for aid."
"Brandy Hall","Which location is known as the main residence of the Brandybuck family, one of the wealthiest and most influential families in the Shire?","Lord Of The Rings","Brandy Hall","The Old Forest","The Barrow-downs","The Bucklebury Ferry","Brandy Hall is a prominent location in the Shire."
"Bree","What is the name of the town where Frodo and his companions, including Aragorn, first meet and stay briefly before embarking on their journey to Rivendell?","Lord Of The Rings","Bree","Buckland","Dagorlad","Emyn Muil","Bree is an important starting point in the story."
"Buckland","What is the name of the region in 'The Lord of the Rings' that lies east of the Shire, known for its wooded landscape and the home of the Brandybuck family, including Merry (Meriadoc Brandybuck)?","Lord Of The Rings","Buckland","Dagorlad","Emyn Muil","Fangorn","Buckland is associated with the Brandybucks."
"Cloak of Invisibility","What magical item, given to Frodo by Galadriel, allows its wearer to become invisible?","Lord Of The Rings","Cloak of Invisibility","Evenstar Pendant","The Horn of Boromir","The Scroll of Isildur","The Cloak of Invisibility makes the wearer invisible."
"Dagorlad","What is the name of the vast, open plain located just outside the Black Gate of Mordor, where the Last Alliance of Elves and Men fought against Sauron's forces?","Lord Of The Rings","Dagorlad","Emyn Muil","Fangorn","Forlindon","Dagorlad is a historic battlefield."
"Dáin Ironfoot","Who ascends to the throne as the King under the Mountain and ruler of Erebor following the passing of Thorin Oakenshield?","Lord Of The Rings","Borin","Thrain II","Durin IV","Gloin III","Dáin Ironfoot assumes leadership in Erebor."
"Dale","Which town located near the Lonely Mountain is rebuilt after the defeat of Smaug?","Lord Of The Rings","Boromir","Theoden","Shelob","Gondor","Dale is rebuilt near the Lonely Mountain."
"Denethor","Who is the Steward of Gondor and father of Boromir and Faramir?","Lord Of The Rings","Balrog","Galadriel","Saruman","Eowyn","Denethor is the Steward of Gondor and the father of Boromir and Faramir."
"Dori","Which Dwarf from Thorin Oakenshield's company is known for his strong sense of responsibility and takes care of the other Dwarves?","Lord Of The Rings","Oin","Nori","Dori","Phial of Galadriel","Dori is responsible and cares for the Dwarves."
"Durin III","Who is the Dwarf King of Khazad-dûm and the third king of Durin's Folk?","Lord Of The Rings","Galadriel's Phial","The Mirror of Galadriel","The Palantir of Orthanc","Durin III","Durin III is the Dwarf King of Khazad-dûm."
"Durin IV","What Dwarf King of Khazad-dûm ruled during the time of Smaug's attack on Erebor?","Lord Of The Rings","The Hobbit","Durin IV","Thrain II","Dáin Ironfoot","Durin IV ruled during that time."
"Durin's Bane","What is the name of the fiery Balrog encountered by the Fellowship of the Ring in the Mines of Moria?","Lord Of The Rings","Boromir","Theoden","Shelob","Gondor","Durin's Bane is the name of the Balrog."
"Dwalin","Which dwarf from Thorin Oakenshield's company is known for his hooded cloak and large war-hammer?","Lord Of The Rings","The Prancing Pony Innkeeper","Glóin","Dwalin","Kili","Dwalin is known for his hooded cloak and war-hammer."
"Eagles","What majestic creatures come to the aid of Frodo and Sam in multiple instances during their journey?","Lord Of The Rings","Uruk-hai","Eagles","Elrond","Radagast the Brown","Eagles come to the aid of Frodo and Sam."
"Elendil","Who is the father of Isildur and Anárion and the last High King of Gondor?","Lord Of The Rings","Elendil","Arwen","Frodo's Journal","Smeagol","Elendil is the father of Isildur and Anárion."
"Elendil's Sword","What is the name of the sword that Aragorn wields, which originally belonged to Elendil, and it is reforged by the Elves and used by Aragorn as the symbol of his claim to the throne of Gondor?","Lord Of The Rings","Elendil's Sword","Isildur's Bane","The Last Debate","The Field of Cormallen","Elendil's Sword is an important weapon."
"Elrond","Who is the Lord of Rivendell and plays a key role in the Council of Elrond?","Lord Of The Rings","Uruk-hai","Eagles","Elrond","Radagast the Brown","Elrond is the Lord of Rivendell and a key figure in the Council of Elrond."
"Emyn Muil","What is the name of the rugged and rocky uplands in 'The Lord of the Rings' that Frodo and Sam traverse after leaving the Fellowship of the Ring and before encountering Gollum?","Lord Of The Rings","Emyn Muil","Fangorn","Forlindon","Goldberry","Emyn Muil is a challenging terrain."
"Eomer","Who is the nephew of King Théoden and leads the Riders of Rohan?","Lord Of The Rings","Balrog","Galadriel","Saruman","Eowyn","Eomer is the nephew of King Théoden and leads the Riders of Rohan."
"Eowyn","Who is the brave shieldmaiden of Rohan who disguises herself as a man to fight in the Battle of Pelennor Fields?","Lord Of The Rings","Balrog","Galadriel","Saruman","Eowyn","Eowyn disguises herself and fights bravely in the Battle of Pelennor Fields."
"Eowyn's Shieldmaiden Armor","What special armor does Éowyn don to disguise herself as a warrior and join the Battle of Pelennor Fields?","Lord Of The Rings","Beorn","Grima Wormtongue","Eowyn's Shieldmaiden Armor","The Mouth of Sauron","Éowyn disguises herself as a warrior with this armor."
"The Sword of Eowyn","What weapon does Eowyn use to defeat the Witch-king of Angmar?","Lord Of The Rings","Gimli's Helmet","The Horn of Helm Hammerhand","Smeagol's Precious","The Sword of Eowyn","Eowyn uses the Sword of Eowyn."
"Erebor","What ancient Dwarf kingdom, also known as the Lonely Mountain, is home to a vast treasure and becomes the focus of the quest?","Lord Of The Rings","The Hobbit","Dale","Erebor","The Arkenstone","Erebor is the Lonely Mountain."
"Fangorn Forest","What ancient forest is the home of the Ents?","Lord Of The Rings","Rivendell","Mordor","Minas Tirith","Hobbiton","Fangorn Forest is the home of the Ents."
"Fangorn","What is the name of the ancient and mysterious forest inhabited by the Ents and their leader Treebeard, where Merry and Pippin find refuge and adventure?","Lord Of The Rings","Fangorn","Forlindon","Goldberry","Gwaihir","Fangorn is a unique forest in Middle-earth."
"Faramir","Who is the younger brother of Boromir and captain of Gondor's Rangers?","Lord Of The Rings","Balrog","Galadriel","Saruman","Eowyn","Faramir is the younger brother of Boromir and captain of Gondor's Rangers."
"Forlindon","What is the name of the coastal region in 'The Lord of the Rings' located in the northwest of Middle-earth, where Círdan the Shipwright's Elven haven of the Grey Havens is situated?","Lord Of The Rings","Forlindon","Goldberry","Gwaihir","Harlindon","Forlindon is a coastal region."
"Lembas Bread","What special Elvish waybread sustains Frodo and Sam during their journey to Mordor?","Lord Of The Rings","Lembas Bread","Isengard","Rohan","Grey Havens","Frodo and Sam are sustained by Lembas Bread."
"Frodo Baggins","Who is the primary protagonist and Ring-bearer?","Lord Of The Rings","Frodo Baggins","Aragorn","Gandalf","Legolas","Frodo Baggins is the primary protagonist and Ring-bearer in the story."
"Elven Rope","What special rope made by the Elves does Frodo carry with him on his journey?","Lord Of The Rings","Gimli's Helmet","Frodo's Mithril Vest","Elven Rope","Galadriel's Mirror","Frodo carries an Elven Rope."
"Mithril Shirt","What precious and lightweight armor does Frodo receive as a gift and wear during his journey?","Lord Of The Rings","Mithril Shirt","Isengard","Rohan","Grey Havens","Frodo receives a Mithril Shirt as a precious and lightweight armor."
"Elven Cloak","What gift does Frodo receive from Galadriel that grants him invisibility?","Lord Of The Rings","Elven Cloak","Isengard","Rohan","Grey Havens","Frodo receives an Elven Cloak that grants him invisibility."
"Phial of Galadriel","What source of light does Frodo use in the dark passages of Shelob's Lair?","Lord Of The Rings","Oin","Nori","Dori","Phial of Galadriel","Frodo uses Galadriel's Phial as a source of light."
"Sting","What is the name of Frodo's Elvish dagger that glows blue in the presence of orcs and goblins?","Lord Of The Rings","The Ringwraiths","The Council of Elrond","Sting","Boromir's Horn","Frodo's Elvish dagger is named Sting."
"Galadhrim","What is the name of the community of elves who reside in the forest of Lothlórien?","Lord Of The Rings","Mithril Shirt","Isengard","Rohan","Grey Havens","Galadhrim is the community of elves in Lothlórien."
"Galadriel","Which powerful and wise elf-lady rules over Lothlórien?","Lord Of The Rings","Balrog","Galadriel","Saruman","Eowyn","Galadriel rules over Lothlórien."
"Galadriel's Mirror","What mystical and reflective basin does Galadriel use to show Frodo visions of the past, present, and future?","Lord Of The Rings","Gimli's Helmet","Frodo's Mithril Vest","Elven Rope","Galadriel's Mirror","Galadriel uses a mystical mirror."
"The Mirror of Galadriel","What mystical object does Galadriel use to show Frodo and Sam visions of past, present, and future events?","Lord Of The Rings","Oin","Nori","Dori","The Mirror of Galadriel","Galadriel uses the Mirror of Galadriel."
"Gandalf the White","What is Gandalf's enhanced title and appearance after his return from death?","Lord Of The Rings","Gandalf the Grey","Gandalf the White","Galadriel","Saruman","Gandalf becomes Gandalf the White after his return from death."
"The Balrog of Moria","What formidable and fiery demon does Gandalf confront in the depths of Moria?","Lord Of The Rings","Ulmo","Valinor","The Watcher in the Water","The Balrog of Moria","Gandalf confronts the Balrog in Moria."
"Balrog","What fiery and fearsome creature does Gandalf confront in the Mines of Moria?","Lord Of The Rings","Balrog","Galadriel","Saruman","Eowyn","Gandalf confronts the Balrog in the Mines of Moria."
"Gandalf the Grey","What is the original name and title of the wizard who guides and supports the Fellowship?","Lord Of The Rings","Gandalf the Grey","Gandalf the White","Galadriel","Saruman","Gandalf the Grey is the original name and title of the wizard."
"Gandalf's Staff","What powerful magical staff is wielded by Gandalf the Grey, one of the Istari wizards?","Lord Of The Rings","Gimli's Helmet","The Horn of Helm Hammerhand","Smeagol's Precious","Gandalf's Staff","Gandalf wields a powerful staff."
"Gimli","Who is the dwarf warrior and member of the Fellowship of the Ring?","Lord Of The Rings","Frodo Baggins","Aragorn","Gandalf","Legolas","Gimli is the dwarf warrior and member of the Fellowship."
"Glamdring","What is the name of Gandalf's sword, which is also known as the Foe-hammer?","Lord Of The Rings","Ulmo","Sting","Glamdring","Orcrist","Glamdring is Gandalf's sword."
"Glóin","Which member of Thorin Oakenshield's company, and father of Gimli, appears?","Lord Of The Rings","The Prancing Pony Innkeeper","Glóin","Bifur","Bofur","Glóin is a member of Thorin's company."
"Glorfindel","Which powerful elf-lord aids Frodo and his companions during their journey?","Lord Of The Rings","Balrog","Galadriel","Saruman","Eowyn","Glorfindel is a powerful elf-lord who aids Frodo and his companions."
"Goldberry","Who is the enigmatic and ethereal character known as the River-woman's daughter, residing in the house of Tom Bombadil near the Withywindle River?","Lord Of The Rings","Goldberry","Gwaihir","Harlindon","Hollin","Goldberry' is associated with Tom Bombadil."
"Gollum","What is the alternate identity of the character Sméagol after being corrupted by the One Ring?","Lord Of The Rings","Rivendell","Gollum","Minas Tirith","Hobbiton","Gollum is the alternate identity of Sméagol after being corrupted by the One Ring."
"Smeagol's Precious","What term does Gollum often use to refer to the One Ring?","Lord Of The Rings","Gimli's Helmet","The Horn of Helm Hammerhand","Smeagol's Precious","The Sword of Elendil","Gollum often calls the One Ring his precious."
"Gondor","What powerful realm is known as the 'White City' and is under the rule of the Stewards?","Lord Of The Rings","Boromir","Theoden","Shelob","Gondor","Gondor is the 'White City' under the rule of the Stewards."
"Grey Havens","What is the port city where elves depart Middle-earth to the Undying Lands?","Lord Of The Rings","Mithril Shirt","Isengard","Rohan","Grey Havens","Grey Havens is the port city where elves depart to the Undying Lands."
"Grima Wormtongue","Which advisor to King Théoden is revealed as a spy and agent of Saruman?","Lord Of The Rings","Beorn","Grima Wormtongue","Eowyn's Shieldmaiden Armor","The Mouth of Sauron","Grima Wormtongue is the spy and advisor to King Théoden."
"Gwaihir the Windlord","Which majestic eagle rescues Gandalf from the pinnacle of Orthanc?","Lord Of The Rings","Balrog","Galadriel","Saruman","Eowyn","Gwaihir the Windlord rescues Gandalf from Orthanc's pinnacle."
"Gwaihir","What is the name of the Lord of the Eagles, a giant eagle who aids Gandalf and rescues Frodo and Sam from Mount Doom in 'The Lord of the Rings'?","Lord Of The Rings","Gwaihir","Harlindon","Hollin","Ithilien","Gwaihir' is a majestic eagle."
"Haldir","Which Elf of Lothlórien plays a significant role in the defense of Helm's Deep alongside the people of Rohan?","Lord Of The Rings","Shadowfax","Haldir","Boromir's Horn","Gimli's Axe","Haldir plays a significant role in the defense of Helm's Deep."
"Harlindon","What is the name of the coastal region in 'The Lord of the Rings' located to the southwest of the Grey Havens, where another Elven haven is situated under the lordship of Círdan?","Lord Of The Rings","Harlindon","Hollin","Ithilien","Quickbeam","Harlindon' is part of Elven territories."
"Helms Deep","Which fortress serves as a crucial defensive point during the Battle of Helm's Deep?","Lord Of The Rings","Helms Deep","Minas Tirith","Rohan","Isengard","Helms Deep is a crucial defensive point during the Battle of Helm's Deep."
"Hobbiton","Which peaceful village is the home of Bilbo and Frodo Baggins?","Lord Of The Rings","Rivendell","Mordor","Minas Tirith","Hobbiton","Hobbiton is the peaceful village where Bilbo and Frodo Baggins live."
"Hollin","What is the name of the ancient land where the Fellowship of the Ring passes through on their journey to and from Moria, and it is known for its tall standing stones, including the Doors of Durin?","Lord Of The Rings","Hollin","Ithilien","Quickbeam","Radagast","Hollin' is a significant location on the journey."
"Homeward Bound","What chapter in 'The Lord of the Rings' describes the journey of the Hobbits as they return to the Shire after their adventures, only to find it changed and in need of their intervention?","Lord Of The Rings","Homeward Bound","The Scouring of the Shire","The Grey Havens","The Last of the Noldor","Homeward Bound' is a significant chapter."
"Imladris","What is the Elvish name for the place commonly known as Rivendell?","Lord Of The Rings","Boromir","Theoden","Shelob","Gondor","Imladris is the Elvish name for Rivendell."
"Isengard","What fortress is initially controlled by Saruman the White?","Lord Of The Rings","Mithril Shirt","Isengard","Rohan","Grey Havens","Isengard is initially controlled by Saruman the White."
"Isildur's Bane","What term is used to refer to the One Ring, especially in the context of its corrupting influence and its ability to control those who possess it?","Lord Of The Rings","Isildur's Bane","Elendil's Sword","The Last Debate","The Field of Cormallen","Isildur's Bane' is a significant concept."
"Ithilien","What is the name of the lush and fertile land in 'The Lord of the Rings' located to the east of Gondor, known for its beautiful gardens and the hidden refuge of Henneth Annûn, where Faramir and his Rangers operate?","Lord Of The Rings","Ithilien","Quickbeam","Radagast","Tharbad","Ithilien' is a strategically important region."
"Khazad-dûm","What ancient dwarven realm lies beneath the Misty Mountains and is known as the Mines of Moria?","Lord Of The Rings","Mithril Shirt","Isengard","Rohan","Grey Havens","Khazad-dûm is the ancient dwarven realm beneath the Misty Mountains."
"Legolas","Which character is renowned for their archery skills and sharp eyesight?","Lord Of The Rings","Frodo Baggins","Aragorn","Gandalf","Legolas","Legolas is renowned for his archery skills and sharp eyesight."
"Lothlórien","Which mystical forest is ruled by Galadriel and Celeborn?","Lord Of The Rings","Rivendell","Mordor","Minas Tirith","Hobbiton","Lothlórien is the mystical forest ruled by Galadriel and Celeborn."
"Many Partings","Which chapter focuses on the farewells and departures of various characters as they go their separate ways after the defeat of Sauron?","Lord Of The Rings","Many Partings","Homeward Bound","The Scouring of the Shire","The Grey Havens","Many Partings' is a chapter of farewells."
"Melkor","Who is the fallen Vala also known as Morgoth and the primary antagonist in 'The Silmarillion'?","Lord Of The Rings","Melkor","Glóin","Bifur","Manwe","Melkor is the fallen Vala and primary antagonist in 'The Silmarillion.'"
"Merry","Which hobbit is known for his love of pipe-weed and gardening in the Shire?","Lord Of The Rings","Frodo Baggins","Aragorn","Gandalf","Legolas","Merry is known for his love of pipe-weed and gardening in the Shire."
"Minas Tirith","What is the capital city of Gondor?","Lord Of The Rings","Rivendell","Mordor","Minas Tirith","Hobbiton","Minas Tirith serves as the capital city of Gondor."
"Mithrandir","What is the Elvish name for Gandalf, one of the Istari wizards, in 'The Silmarillion'?","Lord Of The Rings","Ulmo","Valinor","Narsil","Mithrandir","Mithrandir is the Elvish name for Gandalf."
"Morannon","What is the name of the Black Gate that guards the entrance to Mordor?","Lord Of The Rings","Rivendell","Mordor","Minas Tirith","Hobbiton","Morannon is the Black Gate guarding the entrance to Mordor."
"Mordor","Which land is the primary stronghold of the Dark Lord Sauron?","Lord Of The Rings","Rivendell","Mordor","Minas Tirith","Hobbiton","Mordor is the primary stronghold of the Dark Lord Sauron."
"Mount Doom","To which volcanic mountain does Frodo Baggins journey to destroy the One Ring?","Lord Of The Rings","Rivendell","Mordor","Minas Tirith","Hobbiton","Mount Doom is where Frodo journeys to destroy the One Ring."
"Mount Gundabad","What is the mountain where Azog the Defiler resides and gathers orc armies?","Lord Of The Rings","Boromir","Theoden","Shelob","Gondor","Mount Gundabad is where Azog the Defiler resides."
"Narsil","What is the name of the shattered sword of Elendil, which is reforged into a new blade for Aragorn?","Lord Of The Rings","Ulmo","Valinor","Narsil","Anduril","Narsil is the shattered sword of Elendil."
"Nazgûl","What alternative name is given to the Ringwraiths in 'The Lord of the Rings', emphasizing their terrifying nature and allegiance to Sauron?","Lord Of The Rings","Nazgûl","The Council of Elrond","The Last Alliance of Elves and Men","Many Partings","Nazgûl' is another name for the Ringwraiths."
"Nori","Among Thorin Oakenshield's company of Dwarves, which one is characterized by his love of mischief and has a reputation for being a thief?","Lord Of The Rings","Oin","Nori","Dori","Phial of Galadriel","Nori is known for mischief and thieving."
"Oin","Which member of Thorin Oakenshield's company of Dwarves is known for his expertise as a fire-maker and for his hearing aid device?","Lord Of The Rings","Oin","Nori","Dori","Phial of Galadriel","Oin is known for fire-making and his hearing aid device."
"Orcrist","What is the name of the sword found by Thorin Oakenshield in a troll-hoard, which he later wields?","Lord Of The Rings","Ulmo","Sting","Glamdring","Orcrist","Orcrist is the sword found by Thorin in 'The Hobbit.'"
"Osgiliath","What city in Gondor serves as a key strategic location and is contested between Gondor and Mordor?","Lord Of The Rings","Boromir","Theoden","Shelob","Gondor","Osgiliath is the contested city in Gondor."
"Pippin","Which hobbit is known for his curiosity and sense of adventure among the Fellowship?","Lord Of The Rings","Frodo Baggins","Aragorn","Gandalf","Legolas","Pippin is known for his curiosity and sense of adventure among the Fellowship."
"Prince Imrahil","Who is the noble leader of the Swan Knights of Dol Amroth and a trusted ally of Gondor in 'The Lord of the Rings'?","Lord Of The Rings","Prince Imrahil","The Horn of Gondor","The Corsairs of Umbar","The Battle of the Pelennor Fields","Prince Imrahil' is a notable character."
"Quickbeam","Who is the gentle and thoughtful Ent, a member of the Ents of Fangorn Forest, known for his slow speech and deep thinking, who befriends Merry and Pippin?","Lord Of The Rings","Quickbeam","Radagast","Tharbad","The Eagles","Quickbeam' is a memorable Ent character."
"Radagast the Brown","Which Istari wizard is known for his affinity with animals and nature?","Lord Of The Rings","Uruk-hai","Eagles","Elrond","Radagast the Brown","Radagast the Brown is known for his connection to nature."
