"answer","question","subject","option1","option2","option3","option4","explanation"
"Tom Bombadil","Which enigmatic and merry character rescues the hobbits from the Old Forest?","Lord Of The Rings","Balrog","Galadriel","Saruman","Eowyn","Tom Bombadil rescues the hobbits from the Old Forest."
"Treebeard","Which ancient and wise Ent is the guardian of Fangorn Forest?","Lord Of The Rings","Balrog","Galadriel","Saruman","Eowyn","Treebeard is the guardian of Fangorn Forest."
"Treebeard's Ent-draught","What rejuvenating drink, offered to Merry and Pippin by Treebeard the Ent, causes them to grow taller and stronger?","Lord Of The Rings","Oin","Nori","Dori","Treebeard's Ent-draught","Treebeard offers them an Ent-draught."
"Ulmo","Which Valar is associated with water and is the Lord of Waters in 'The Silmarillion'?","Lord Of The Rings","Ulmo","Valinor","Narsil","Anduril","Ulmo is the Valar associated with water."
"Uruk-hai","What fearsome breed of orc are created by Saruman and serve as his army?","Lord Of The Rings","Uruk-hai","Eagles","Elrond","Radagast the Brown","Uruk-hai are the fearsome orcs created by Saruman."
"Valinor","What is the name of the Undying Lands where the Valar and the Eldar dwell in 'The Silmarillion'?","Lord Of The Rings","Ulmo","Valinor","Narsil","Anduril","Valinor is the Undying Lands of the Valar and Eldar."
"Varda","Which Valar is also known as Elbereth and is associated with the stars and light in 'The Silmarillion'?","Lord Of The Rings","Varda","Glóin","Bifur","Yavanna","Varda is also known as Elbereth and associated with stars and light."
"Yavanna","Which Valar is responsible for the creation of plants and is often associated with nature in 'The Silmarillion'?","Lord Of The Rings","Varda","Glóin","Bifur","Yavanna","Yavanna is a Valar associated with nature in 'The Silmarillion.'"
"Fili","Which dwarf from Thorin Oakenshield's company is the brother of Kili and known for his fair hair?","Lord Of The Rings","Yavanna","Kili","Fili","Balimund","Fili is the brother of Kili and known for his fair hair."
"Kili","Which young dwarf from Thorin Oakenshield's company has a close relationship with his brother Fili?","Lord Of The Rings","Yavanna","Kili","Fili","Balimund","Kili has a close relationship with his brother Fili."
"The Battle of Dale","What climactic battle takes place as part of the conflict involving the Men of Dale, Elves, Dwarves, and Orcs?","Lord Of The Rings","The Battle of Helm's Deep","The Battle of the Hornburg","The Battle of Azanulbizar","The Battle of Dale","The Battle of Dale was a climactic conflict that took place in the vicinity of Dale, involving the Men of Dale, Elves, Dwarves, and Orcs."
"The White Council","What council of powerful beings, including wizards and Elves, forms to oppose the growing power of Sauron?","Lord Of The Rings","The Watcher in the Water","The Ford of Bruinen","The White Council","The Nazgûl","The White Council was a powerful assembly of beings, including wizards and Elves, formed to oppose Sauron and his growing power."
"The Barrow-downs","What eerie and ancient burial mounds pose a danger to Frodo and his companions as they journey through the Old Forest?","Lord Of The Rings","Dol Guldur","Mirkwood","The Barrow-downs","The Dead Marshes","The Barrow-downs are eerie and ancient burial mounds that pose a danger to Frodo and his companions as they journey through the Old Forest."
"The Paths of the Dead","What eerie and haunted passageways in the White Mountains are traversed by Aragorn and the Grey Company?","Lord Of The Rings","Dol Guldur","Cirith Ungol","The Bridge of Khazad-dûm","The Paths of the Dead","The Paths of the Dead are eerie and haunted passageways located in the White Mountains. Aragorn and the Grey Company traverse these eerie paths, seeking to fulfill an ancient oath and enlist the spectral Dead Men of Dunharrow in the war against Sauron."
"The Battle of Helm's Deep","What epic battle occurs between the people of Rohan and Saruman's Uruk-hai forces, culminating in a dramatic victory for the defenders of Rohan?","Lord Of The Rings","The Battle of Azanulbizar","The Battle of the Five Armies","The Great Smials","The Battle of Helm's Deep","The Battle of Helm's Deep is a major conflict."
"The Fall of Sauron","What event marks the ultimate defeat of The Dark Lord and the destruction of the One Ring, leading to the end of the War of the Ring?","Lord Of The Rings","The Destruction of Isengard","The Siege of Minas Tirith","The Battle of Helm's Deep","The Fall of Sauron","In the climactic culmination of the War of the Ring, The Fall of Sauron marked The Dark Lord's defeat, bringing an end to his malevolent reign and the destruction of the One Ring, which marked a pivotal moment in the history of Middle-earth."
"The Last Alliance of Elves and Men","What historic alliance was formed to combat the Dark Lord Sauron at the end of the Second Age?","Lord Of The Rings","The Fellowship of the Ring","The White Council","The Free Peoples of Middle-earth","The Last Alliance of Elves and Men","The Last Alliance of Elves and Men was a historic alliance that was formed between Elves and Men to combat the Dark Lord Sauron at the end of the Second Age."
"Michel Delving","What is the chief town and capital of the Shire, known for its imposing white stone buildings?","Lord Of The Rings","Hobbiton","Buckland","Tuckborough","Michel Delving","Michel Delving was the chief town of the Shire. It was located in the White Downs that lay within the Westfarthing on the East Road. Although located within a hilly region the town had many above-ground houses of wood, brick, or stone."
"The Great Smials","What is the name of one of the two main residences of the prominent Took family in the Shire, known for their adventurous spirit?","Lord Of The Rings","The Destruction of Isengard","The Siege of Minas Tirith","The Witch-king of Angmar","The Great Smials","The Great Smials is a Took residence."
"The Battle of the Hornburg","What is the name of the epic battle that takes place at the fortress of Helm's Deep Where the people of Rohan face a massive Uruk-hai assault?","Lord Of The Rings","The Battle of Azanulbizar","The Battle of the Five Armies","The Great Smials","The Battle of the Hornburg","The Battle of the Hornburg is a significant battle."
"The Hornburg","What is the name of the fortress of Rohan, also known as Helm's Deep, which serves as a stronghold against the forces of Saruman and later Sauron?","Lord Of The Rings","Minas Tirith","Caras Galadhon","Osgiliath","The Hornburg","The Hornburg, also called Helm's Deep, was a strategically located fortress in Rohan, known for its pivotal role in a heroic defense against Saruman's Uruk-hai forces."
"The War of The Ring","What is the overarching conflict between the forces of good, led by the Free Peoples of Middle-earth, and the forces of evil, led by Sauron and his allies?","Lord Of The Rings","The Battle of the Last Alliance","The War of the Ring","The Battle of Bywater","The Battle of the Five Armies","The War of The Ring is the overarching conflict."
"The Key to Erebor","What item, used by Thorin Oakenshield's company to enter the Lonely Mountain, is instrumental in opening the secret door to Erebor?","Lord Of The Rings","Cloak of Invisibility","Evenstar Pendant","The Horn of Boromir","The Key to Erebor","The Key to Erebor is used to open the secret door to Erebor."
"Barrow-wights","What malevolent spirits or creatures attack Frodo, Sam, Merry, and Pippin in the Barrow-downs?","Lord Of The Rings","Valar","Maiar","Nazgûl","Barrow-wights","Barrow-wights are malevolent spirits or wraiths that inhabit ancient burial mounds in the Barrow-downs near the Old Forest. They pose a significant danger to travelers, particularly to Frodo and his companions, using their powers to ensnare and terrify those who venture too close."
"The Siege of Gondor","What pivotal event involves the city of Gondor facing a massive assault by the forces of Mordor, including the Witch-king of Angmar, during the War of the Ring?","Lord Of The Rings","The Battle of Azanulbizar","The Battle of the Five Armies","The Great Smials","The Siege of Gondor ","The Siege of Gondor is a crucial event."
"The Palantir of Minas Tirith","What powerful and ancient seeing stone does Denethor, the Steward of Gondor, employ to establish communication with others?","Lord Of The Rings","Cloak of Invisibility","The Phial of Galadriel","Andúril","The Palantir of Minas Tirith","The Palantir of Minas Tirith is a powerful seeing stone."
"The Palantir of Orthanc","What powerful and ancient seeing-stone, used by Saruman the White, is kept in the tower of Orthanc in Isengard?","Lord Of The Rings","Narsil","The Horn of Boromir","The Evenstar Pendant","The Palantir of Orthanc","The Palantir of Orthanc is a potent artifact."
"The Arkenstone","What fabled and priceless gem, the 'Heart of the Mountain', lies within the ancient halls of Erebor and plays a central role in The Battle of the Five Armies?","Lord Of The Rings","Narsil","Andúril","The Palantíri","The Arkenstone","The Arkenstone is a legendary and radiant gem, often referred to as the 'Heart of the Mountain'. It becomes a focal point of greed and conflict as various parties, including Thorin Oakenshield and the rivaling factions in The Battle of the Five Armies, vie for its possession."
"The Battle of the Five Armies","What significant conflict involving Dwarves, Elves, Men, and Goblins takes place near the Lonely Mountain?","Lord Of The Rings","The Battle of Dale","The Battle of Bywater","The Siege of Gondor","The Battle of the Five Armies","TThe Battle of the Five Armies is a pivotal battle near the Lonely Mountain. The conflict erupts due to the tension over the vast wealth within the mountain and escalates as different factions vie for control."
"Bard","Which formidable warrior, distinguished for their exceptional archery and originating from Lake-town, plays a pivotal role in the defeat of Smaug during the Battle of the Five Armies?","Lord Of The Rings","Legolas","Thorin","Dori","Bard","Bard is a skilled warrior and archer hailing from Lake-town who emerges as a central figure in the Battle of the Five Armies by successfully slaying the fearsome dragon, Smaug. He later plays a key role in the political and military events following the battle, particularly in his interactions with the other factions involved."
"Tuckborough","Which village in the Westfarthing of the Shire is known for its picturesque location near the Brandywine River and is home to the Tooks and the Great Smials?","Lord Of The Rings","Bywater","Buckland","Hobbiton","Tuckborough","Tuckborough is a picturesque village located near the Brandywine River in the Westfarthing of the Shire. It is known for being the home of the Tooks and the Great Smials, reflecting the adventurous spirit of its residents."
"Thorin Oakenshield","Who is the leader of the company of Dwarves on a quest to reclaim the Lonely Mountain and its treasure?","Lord Of The Rings","Bilbo Baggins","Bombur","Gandalf the Grey","Thorin Oakenshield","horin Oakenshield serves as the valiant leader of a company of dwarves on a quest to reclaim the Lonely Mountain from the dragon Smaug and restore their people's lost kingdom and treasure, but his unyielding pursuit of riches ultimately leads to his downfall."
"The Battle of Bywater","In which final conflict of the War of the Ring do Hobbits, led by Merry and Pippin, face and defeat the ruffians who have taken control of the Shire?","Lord Of The Rings","The Battle of the Pelennor Fields","The Battle of the Black Gate","The Siege of Gondor","The Battle of Bywater","In the Battle of Bywater, the Hobbits, led by Merry and Pippin, engaged in a final conflict against the ruffians who had taken control of the Shire. This decisive battle marked the end of the War of the Ring in the Shire and resulted in the defeat of the oppressive forces that had seized power in their homeland."
"The Council of Elrond","In which gathering of Free Peoples of Middle-earth is the fate of the One Ring decided, leading to the formation of the Fellowship of the Ring?","Lord Of The Rings","The Kingdom of Gondor","The Court of Rohan","The Council of Elrond","The Quendi","The Council of Elrond was a pivotal gathering of Free Peoples of Middle-earth, during which the fate of the One Ring was decided, ultimately leading to the formation of the Fellowship of the Ring."
"Yew Wood with a Phoenix Feather Core","What type of wood and core material is used in Voldemort's wand?","Harry Potter","Walnut Wood with a Dragon Heartstring Core","Hawthorn Wood with a Unicorn Hair Core","Cypress Wood with a Unicorn Hair Core","Yew Wood with a Phoenix Feather Core","Voldemort's wand is made of Yew wood with a Phoenix feather core."
"Wormtail","What is the nickname of Peter Pettigrew, one of Voldemort's loyal followers?","Harry Potter","Holly Wood with a Phoenix Feather Core","The Whomping Willow","The Yule Ball","Wormtail","Wormtail is the nickname of Peter Pettigrew."
"Wingardium Leviosa","Which spell is used to make objects float in the air?","Harry Potter","Incendio","Alohomora","Nox","Wingardium Leviosa","The Wingardium Leviosa spell is used to levitate objects off the ground."
"Willow Wood with a Unicorn Hair Core","What type of wood and core material is used in Harry Potter's first wand?","Harry Potter","Vine Wood with a Dragon Heartstring Core","Elder Wood with a Phoenix Feather Core","Unknown Wood with a Dragon Heartstring Core","Willow Wood with a Unicorn Hair Core","Harry's first wand is made of Willow wood with a Unicorn hair core."
"Walnut Wood with a Dragon Heartstring Core.","What type of wood and core material is used in Ron Weasley's second wand?","Harry Potter","Hawthorn Wood with a Unicorn Hair Core","Cypress Wood with a Unicorn Hair Core","Willow Wood with a Unicorn Hair Core","Walnut Wood with a Dragon Heartstring Core.","Ron Weasley's second wand is made of Walnut wood with a Dragon heartstring core."
"Vine Wood with a Dragon Heartstring Core","What type of wood and core material is used in Viktor Krum's wand?","Harry Potter","Elder Wood with a Phoenix Feather Core","Unknown Wood with a Dragon Heartstring Core","Willow Wood with a Unicorn Hair Core","Vine Wood with a Dragon Heartstring Core","Viktor Krum's wand is made of Vine wood with a Dragon heartstring core."
"Vincent Crabbe","Who is one of Draco Malfoy's close friends and associates among the Slytherin students?","Harry Potter","Wormtail","Holly Wood with a Phoenix Feather Core","The Whomping Willow","Vincent Crabbe","Vincent Crabbe is a Slytherin student."
"Viktor Krum","Who is the talented Quidditch player from Bulgaria who competes in the Triwizard Tournament in 'Harry Potter and the Goblet of Fire'?","Harry Potter","Vincent Crabbe","Wormtail","Holly Wood with a Phoenix Feather Core","Viktor Krum","Viktor Krum is a Triwizard Tournament champion."
"Vernon Dursley","Who is Harry Potter's uncle and the head of the Dursley family?","Harry Potter","Petunia Dursley","Dudley Dursley","Room of Requirement","Vernon Dursley","Vernon Dursley is Harry's uncle."
"Unknown Wood with a Dragon Heartstring Core","What type of wood and core material is used in Bellatrix Lestrange's wand?","Harry Potter","Yew Wood with a Phoenix Feather Core","Walnut Wood with a Dragon Heartstring Core.","Hawthorn Wood with a Unicorn Hair Core","Unknown Wood with a Dragon Heartstring Core","Bellatrix Lestrange's wand is made of Unknown wood with a Dragon heartstring core."
"Tom Riddle's Diary","Which object serves as one of Voldemort's Horcruxes and possesses the ability to possess and control its user in 'Harry Potter and the Chamber of Secrets'?","Harry Potter","Victor Krum's Dragon","Viktor Krum","Vincent Crabbe","Tom Riddle's Diary","Tom Riddle's Diary is a Horcrux."
"Tom Riddle's Diary","What magical document shows a detailed, live-action map of Hogwarts School of Witchcraft and Wizardry?","Harry Potter","The Mirror of Erised","The Order of the Phoenix","The Philosopher's Stone","The Marauder's Map","The Marauder's Map displays Hogwarts map."
"Tom Riddle","What is the birth name of the young wizard who later becomes known as Lord Voldemort?","Harry Potter","Tom Riddle's Diary","Victor Krum","Viktor Krum","Tom Riddle","Tom Riddle is Voldemort's birth name."
"Thestrals","What winged, skeletal creatures are visible only to those who have witnessed death?","Harry Potter","Tom Riddle","Tom Riddle's Diary","Victor Krum's Dragon","Thestrals","Thestrals are visible to some due to death."
"Thestral Carriages","What horse-like magical creatures pull the carriages that transport students from Hogwarts Express to Hogwarts Castle?","Harry Potter","Thestrals","Tom Riddle","Tom Riddle's Diary","Thestral Carriages","Thestral Carriages transport students."
"The Yule Ball","What formal event is held at Hogwarts School of Witchcraft and Wizardry during the Triwizard Tournament in 'Harry Potter and the Goblet of Fire'?","Harry Potter","Thestral Carriages","Thestrals","Tom Riddle","The Yule Ball","The Yule Ball is a formal event."
"The Whomping Willow","What dangerous magical tree is planted on the grounds of Hogwarts?","Harry Potter","The Yule Ball","Thestral Carriages","Thestrals","The Whomping Willow","The Whomping Willow is a dangerous tree."
"The Veil","What mysterious object in the Department of Mysteries is a gateway to the afterlife?","Harry Potter","The Sorcerer's Stone","The Sorting Hat","The Sword of Gryffindor","The Veil","The Veil is a mysterious gateway to the afterlife."
"The Unforgivable Curses","What are the three forbidden curses in the Harry Potter series, considered to be the darkest spells?","Harry Potter","The Veil","The Sorcerer's Stone","The Sorting Hat","The Unforgivable Curses","The Unforgivable Curses are dark and forbidden spells."
"The Unbreakable Vow","What magical vow is considered unbreakable and is featured?","Harry Potter","The Unforgivable Curses","The Veil","The Sorcerer's Stone","The Unbreakable Vow","The Unbreakable Vow is a significant magical commitment."
"The Triwizard Tournament","Which major international Quidditch sporting event is held every four years?","Harry Potter","The Unbreakable Vow","The Unforgivable Curses","The Veil","The Triwizard Tournament","The Triwizard Tournament is a central event."
"The Three Broomsticks","What is the name of the popular pub in Hogsmeade frequented by wizards and witches?","Harry Potter","The Triwizard Cup","The Unbreakable Vow","The Unforgivable Curses","The Three Broomsticks","The Three Broomsticks is a well-known pub."
"The Tale of the Three Brothers","Which wizarding fairy tale tells the story of three magical brothers and the Deathly Hallows in 'Harry Potter and the Deathly Hallows'?","Harry Potter","The Third Task","The Three Broomsticks","The Triwizard Cup","The Tale of the Three Brothers","The tale tells the story of the Deathly Hallows."
"The Sword of Gryffindor","What powerful magical weapon is used by Harry to defeat the basilisk in the Chamber of Secrets in 'Harry Potter and the Chamber of Secrets'?","Harry Potter","The Tale of the Three Brothers","The Third Task","The Three Broomsticks","The Sword of Gryffindor","The Sword of Gryffindor is a significant weapon."
"The Sorting Hat","What magical object is used to assign students to their respective Hogwarts houses?","Harry Potter","The Sword of Gryffindor","The Tale of the Three Brothers","The Third Task","The Sorting Hat","The Sorting Hat sorts students into houses."
"The Sorcerer's Stone","What is the alternative title for the first book in the Harry Potter series, known as 'Harry Potter and the Philosopher's Stone' in the UK?","Harry Potter","The Sorting Hat","The Sword of Gryffindor","The Tale of the Three Brothers","The Sorcerer's Stone","The Sorcerer's Stone is the alternative title."
"The Shrieking Shack","What building near Hogsmeade is known for being haunted and is central to the plot in 'Harry Potter and the Prisoner of Azkaban'?","Harry Potter","The Slug Club","The Portkey","The Prisoner of Azkaban","The Shrieking Shack","The Shrieking Shack is a significant location in the third book."
"The Room of Requirement","What magical room at Hogwarts only appears when a person is in great need?","Harry Potter","The Second Task","The Shrieking Shack","The Slug Club","The Room of Requirement","The Room of Requirement appears when needed."
"The Ring Horcrux","Which object serves as one of Voldemort's Horcruxes and is connected to the Gaunt family?","Harry Potter","The Room of Requirement","The Second Task","The Shrieking Shack","The Ring Horcrux","The Ring Horcrux has ties to the Gaunt family."
"The Resurrection Stone","What is one of the Deathly Hallows that allows its possessor to bring back the dead briefly?","Harry Potter","The Ring Horcrux","The Room of Requirement","The Second Task","The Resurrection Stone","The Resurrection Stone is one of the Deathly Hallows."
"The Quidditch Pitch","Where do Quidditch matches take place?","Harry Potter","The Resurrection Stone","The Ring Horcrux","The Room of Requirement","The Quidditch Pitch","Quidditch matches happen on the pitch."
"The Quibbler","What is the name of the eccentric wizarding magazine edited by Xenophilius Lovegood?","Harry Potter","The Quidditch Pitch","The Resurrection Stone","The Ring Horcrux","The Quibbler","Xenophilius Lovegood edits The Quibbler."
"The Prophecy","What significant object foretells the prophecy about Harry and Voldemort's fate in 'Harry Potter and the Order of the Phoenix'?","Harry Potter","The Quibbler","The Quidditch Pitch","The Resurrection Stone","The Prophecy","The prophecy is crucial in the fifth book's plot."
"The Prisoner of Azkaban","Which book in the Harry Potter series is the third installment, featuring Sirius Black and the Marauder's Map?","Harry Potter","The Prophecy","The Quibbler","The Quidditch Pitch","The Prisoner of Azkaban","The Prisoner of Azkaban is the third book."
"The Portkey","What magical object is used to transport Harry to the Triwizard Tournament in 'Harry Potter and the Goblet of Fire'?","Harry Potter","The Prisoner of Azkaban","The Prophecy","The Quibbler","The Portkey","The Portkey is used for transportation to the tournament."
"The Philosopher's Stone","What magical object is sought by Voldemort to regain his full strength in 'Harry Potter and the Philosopher's Stone'?","Harry Potter","The Invisibility Cloak","The King's Cross","The Knight Bus","The Philosopher's Stone","The Philosopher's Stone is a sought-after object."
"The Order of the Phoenix","What secret organization is led by Albus Dumbledore to fight against Voldemort's forces?","Harry Potter","The Philosopher's Stone","The Invisibility Cloak","The King's Cross","The Order of the Phoenix","The Order of the Phoenix opposes Voldemort."
"The Mirror of Erised","What enchanted mirror shows the deepest desires of the heart?","Harry Potter","The Order of the Phoenix","The Philosopher's Stone","The Invisibility Cloak","The Mirror of Erised","The Mirror of Erised reveals desires."
"The Lost Diadem of Ravenclaw","What item from Hogwarts is turned into a Horcrux by Voldemort in 'Harry Potter and the Deathly Hallows'?","Harry Potter","The Marauder's Map","The Mirror of Erised","The Order of the Phoenix","The Lost Diadem of Ravenclaw","The Lost Diadem of Ravenclaw becomes a Horcrux."
"The Locket Horcrux","Which object serves as one of Voldemort's Horcruxes and is worn by Dolores Umbridge in 'Harry Potter and the Deathly Hallows'?","Harry Potter","The Lost Diadem of Ravenclaw","The Marauder's Map","The Mirror of Erised","The Locket Horcrux","The Locket Horcrux is worn by Umbridge."
"The Leaky Cauldron","What is the name of the pub in London that serves as the gateway to Diagon Alley?","Harry Potter","The Locket Horcrux","The Lost Diadem of Ravenclaw","The Marauder's Map","The Leaky Cauldron","The Leaky Cauldron is the entrance to Diagon Alley."
"The Knight Bus","What is the name of the magical bus that transports witches and wizards in emergencies?","Harry Potter","The Leaky Cauldron","The Locket Horcrux","The Lost Diadem of Ravenclaw","The Knight Bus","The Knight Bus provides emergency transportation."
"The Invisibility Cloak","What magical item allows the wearer to become invisible?","Harry Potter","The King's Cross","The Knight Bus","The Leaky Cauldron","The Invisibility Cloak","The Invisibility Cloak grants invisibility."
"The Inquisitorial Squad","What is the name of the group of students appointed by Dolores Umbridge to assist in enforcing rules at Hogwarts in 'Harry Potter and the Order of the Phoenix'?","Harry Potter","The Half-Blood Prince","The Hall of Prophecy","Buckbeak","The Inquisitorial Squad","The Inquisitorial Squad assists Umbridge in enforcing."
"The Hungarian Horntail","In 'Harry Potter and the Goblet of Fire', which dragon does Harry face during the Triwizard Tournament's first task at the Triwizard Cup competition?","Harry Potter","The Swedish Short-Snout","The Norwegian Ridgeback","The Chinese Fireball","The Hungarian Horntail","Harry faces the Hungarian Horntail in the Dragon Challenge."
"Hungarian Horntail","Which dragon species is used as a task for the Triwizard Tournament in 'Harry Potter and the Goblet of Fire'?","Harry Potter","Inquisitorial Squad","Half-Blood Prince","Hall of Prophecy","The Hungarian Horntail","The Hungarian Horntail is one of the Triwizard Tournament tasks."
"Horcruxes","What are the objects in which Voldemort splits his soul to achieve immortality?","Harry Potter","Hungarian Horntail","Inquisitorial Squad","Half-Blood Prince","The Horcruxes","Voldemort creates Horcruxes to achieve immortality."
"Hogwarts Express","What is the name of the train that takes students to Hogwarts School of Witchcraft and Wizardry?","Harry Potter","Horcruxes","Hungarian Horntail","Inquisitorial Squad","Hogwarts Express","Hogwarts Express is the train to Hogwarts."
