"answer","question","subject","option1","option2","option3","option4","explanation"
"Gilderoy Lockhart","Who is a famous but somewhat incompetent wizard and author in the Harry Potter series, known for his charm and good looks?","Harry Potter","Fred Weasley","Fleur Delacour","Fred and George Weasley's Joke Shop","Gilderoy Lockhart","Gilderoy Lockhart is known for his celebrity status and books."
"George Weasley","Which Weasley twin is known for his sense of humor and co-owns Weasleys' Wizard Wheezes?","Harry Potter","Gilderoy Lockhart","Fred Weasley","Fleur Delacour","George Weasley","George Weasley is known for his sense of humor."
"Gellert Grindelwald","Who is a dark wizard and one of Albus Dumbledore's former close friends, known for his dangerous ideas and actions?","Harry Potter","George Weasley","Gilderoy Lockhart","Fred and George Weasley's Joke Shop","Gellert Grindelwald","Gellert Grindelwald is a dark wizard and a significant character."
"Fred Weasley","Which Weasley twin is known for his sense of humor and co-owns Weasleys' Wizard Wheezes?","Harry Potter","Gellert Grindelwald","George Weasley","Gilderoy Lockhart","Fred Weasley","Fred Weasley is known for his sense of humor."
"Fred and George Weasleys Joke Shop","Which joke shop is owned by the mischievous Weasley twins and becomes very popular?","Harry Potter","Fred Weasley","Gellert Grindelwald","George Weasley","Fred and George Weasleys Joke Shop","Fred and George Weasley own the joke shop."
"Fleur Delacour","Who is a talented and graceful Beauxbatons Academy student and a Triwizard Tournament champion?","Harry Potter","Fred and George Weasley","Fred Weasley","Gilderoy Lockhart","Fleur Delacour","Fleur Delacour represents Beauxbatons in the Triwizard Tournament."
"Filius Flitwick","Who is the Charms Master and head of Ravenclaw House at Hogwarts?","Harry Potter","Rubeus Hagrid","Remus Lupin","Minerva McGonagall","Filius Flitwick","Filius Flitwick is the Charms Master at Hogwarts."
"Expulso","Which spell is used to cause objects to explode?","Harry Potter","imperio","reducto","crucio","Expulso","The Expulso spell causes objects to explode when cast."
"Expelliarmus","What spell is commonly used to disarm opponents by forcing them to release whatever they are holding?","Harry Potter","protego","Expulso","Stupefy","Expelliarmus","Expelliarmus is the Disarming Charm used to disarm opponents by forcing them to release what they are holding."
"Expecto Patronum","Which spell conjures a Patronus to ward off Dementors and other dark creatures?","Harry Potter","Incendio","Lumos","Nox","Expecto Patronum","Expecto Patronum is used to summon a Patronus, which is a protective guardian against dark creatures like Dementors."
"Elder Wood with a Phoenix Feather Core","What type of wood and core material is used in the Elder Wand, one of the Deathly Hallows?","Harry Potter","Unknown Wood with a Dragon Heartstring Core","Yew Wood with a Phoenix Feather Core","Walnut Wood with a Dragon Heartstring Core.","Elder Wood with a Phoenix Feather Core","The Elder Wand is made of Elder wood with a Phoenix feather core."
"Dumbledore","Who is the wise and respected headmaster of Hogwarts School of Witchcraft and Wizardry?","Harry Potter","Fleur Delacour","Fred Weasley","Gilderoy Lockhart","Dumbledore","Albus Dumbledore is the headmaster of Hogwarts."
"Dudley Dursley","Who is Harry Potter's cousin and the son of Vernon and Petunia Dursley?","Harry Potter","Room of Requirement","Vernon Dursley","Petunia Dursley","Dudley Dursley","Dudley Dursley is Harry's cousin."
"Draco Malfoy","Who is a student at Hogwarts and a member of the Slytherin house, known for his rivalry with Harry Potter?","Harry Potter","Dumbledore","Fleur Delacour","Fred and George Weasleys Joke Shop","Draco Malfoy","Draco Malfoy is a student in Slytherin with a rivalry with Harry."
"Dolores Umbridge","Who is the Hogwarts High Inquisitor and a character known for her strict and oppressive rule over the school?","Harry Potter","Draco Malfoy","Dumbledore","Fleur Delacour","Dolores Umbridge","Dolores Umbridge serves as the High Inquisitor at Hogwarts."
"Dolores Umbridge","Who is the Senior Undersecretary to the Minister for Magic and a tyrannical Hogwarts High Inquisitor?","Harry Potter","Albus Dumbledore","Filius Flitwick","Rubeus Hagrid","Dolores Umbridge","Dolores Umbridge is a controversial character in the series."
"Dobby the House Elf","Which house-elf is known for his loyalty to Harry Potter and his role in various events?","Harry Potter","Fred and George Weasleys Joke Shop","Fred Weasley","Gellert Grindelwald","Dobby the House Elf","Dobby is a house-elf known for his loyalty to Harry."
"Diagon Alley","Which magical shopping district in London is known for its various wizarding shops and businesses?","Harry Potter","Dobby the House Elf","Fred Weasley","Draco Malfoy","Diagon Alley","Diagon Alley is a famous wizarding shopping district in London."
"Cypress Wood with a Unicorn Hair Core","What type of wood and core material is used in the wand of Sybill Trelawney, the Divination professor,?","Harry Potter","Willow Wood with a Unicorn Hair Core","Vine Wood with a Dragon Heartstring Core","Hawthorn Wood with a Unicorn Hair Core","Cypress Wood with a Unicorn Hair Core","Sybill Trelawney's wand is made of Cypress wood with a Unicorn hair core."
"crucio","Which Unforgivable Curse inflicts excruciating pain on the target?","Harry Potter","imperio","reducto","Expelliarmus","crucio","The Cruciatus Curse, or Crucio, is used to torture and cause severe pain to the victim."
"Crookshanks","What is the name of Hermione Granger's pet cat, known for its squashed face and distinctive appearance?","Harry Potter","Diagon Alley","Dobby the House Elf","Dolores Umbridge","Crookshanks","Crookshanks is Hermione's pet cat."
"Colin Creevey","Who is a young and enthusiastic photographer and a student at Hogwarts?","Harry Potter","Dobby the House Elf","Fred Weasley","Draco Malfoy","Colin Creevey","Colin Creevey is known for his enthusiasm and his camera."
"Cho Chang","Who is a Hogwarts student and a member of the Ravenclaw Quidditch team?","Harry Potter","Bill Weasley","Cedric Diggory","Charlie Weasley","Cho Chang","Cho Chang is a Ravenclaw student who plays Quidditch for her house."
"Charlie Weasley","Which Weasley sibling is known for his interest in dragons and works with them in Romania?","Harry Potter","Cho Chang","Bill Weasley","Barty Crouch Jr.","Charlie Weasley","Charlie Weasley works with dragons in Romania."
"Cedric Diggory","Which Hogwarts student from Hufflepuff competes as one of the champions in the Triwizard Tournament?","Harry Potter","Charlie Weasley","Cho Chang","Bill Weasley","Cedric Diggory","Cedric Diggory is a Hufflepuff student who participates in the Triwizard Tournament."
"Buckbeak","What is the name of the hippogriff introduced in 'Harry Potter and the Prisoner of Azkaban'?","Harry Potter","Hogwarts Express","The Horcruxes","The Hungarian Horntail","Buckbeak","Buckbeak is the name of the hippogriff."
"Blast-Ended Skrewts","In 'Harry Potter and the Goblet of Fire', what dangerous magical creatures are released in the maze during the third task of the Triwizard Tournament, making it even more perilous for the champions?","Harry Potter","Acromantulas","Thestrals","Nifflers","Blast-Ended Skrewts","The Blast-Ended Skrewts are released in the maze during the third challenge of the Triwizard Tournament."
"Bill Weasley","Which Weasley sibling is known for working as a curse breaker for Gringotts Wizarding Bank?","Harry Potter","Cedric Diggory","Charlie Weasley","Cho Chang","Bill Weasley","Bill Weasley works as a curse breaker for Gringotts Wizarding Bank."
"Bellatrix Lestrange","Which Death Eater is known for her extreme loyalty to Lord Voldemort and her role?","Harry Potter","Bill Weasley","Cedric Diggory","Charlie Weasley","Bellatrix Lestrange","Bellatrix Lestrange is known for her extreme loyalty to Voldemort and her actions in the series."
"Bathilda Bagshot","Who is the author of the wizarding book 'A History of Magic'?","Harry Potter","Bellatrix Lestrange","Bill and Fleur's Wedding","Cedric Diggory","Bathilda Bagshot","Bathilda Bagshot is the author of the wizarding book 'A History of Magic.'"
"Barty Crouch Jr.","Who impersonated Mad-Eye Moody using Polyjuice Potion in the Triwizard Tournament during the events of the Harry Potter series?","Harry Potter","Bellatrix Lestrange","Bathilda Bagshot","Charlie Weasley","Barty Crouch Jr.","Barty Crouch Jr. impersonated Mad-Eye Moody as part of a plot in the Triwizard Tournament."
"Avada Kedavra","Which curse is known as one of the Unforgivable Curses and causes instant death to the target?","Harry Potter","crucio","Expulso","Stupefy","Avada Kedavra","Avada Kedavra is the Killing Curse, infamous for its lethal effects."
"Arthur Weasley","Which Weasley family member works at the Ministry of Magic and has a fascination with Muggle inventions?","Harry Potter","Bill Weasley","Barty Crouch Jr.","Cho Chang","Arthur Weasley","Arthur Weasley is known for his fascination with Muggle inventions and works at the Ministry of Magic."
"Argus Filch","Who is the caretaker of Hogwarts and known for his dislike of students breaking rules?","Harry Potter","Bathilda Bagshot","Bellatrix Lestrange","Arthur Weasley","Argus Filch","Argus Filch serves as the caretaker of Hogwarts and enforces the school's rules."
"Aragog","What is the name of Hagrid's giant pet spider?","Harry Potter","Aragog's Funeral","Charlie Weasley","Bill Weasley","Aragog","Aragog is the name of Hagrid's giant pet spider."
"Alohomora","What spell is commonly used to unlock doors and objects?","Harry Potter","Expelliarmus","Nox","Lumos","Alohomora","Alohomora is the spell used to unlock doors and objects, allowing access."
"Albus Dumbledore","Who is the wise and respected headmaster of Hogwarts School of Witchcraft and Wizardry?","Harry Potter","Filius Flitwick","Rubeus Hagrid","Remus Lupin","Albus Dumbledore","Albus Dumbledore is the headmaster of Hogwarts."
"Alastor Moody","Who is a famous Auror and a member of the Order of the Phoenix, known for his magical eye?","Harry Potter","Quirinus Quirrell","Horace Slughorn","Severus Snape","Alastor Moody","Alastor Moody is a skilled Auror with a magical eye."
"Accio","Which spell is used for summoning objects?","Harry Potter","Alohomora","Stupefy","Expecto Patronum","Accio","The Accio spell is known for summoning objects to the caster's location."
"Luke Skywalker","Who is known as the hero of the Rebel Alliance and the son of Anakin Skywalker?","Star Wars","Princess Leia Organa","Han Solo","Darth Vader","Luke Skywalker","Luke Skywalker is the hero of the Rebel Alliance and the son of Anakin Skywalker."
"Princess Leia Organa","Who is the skilled diplomat and leader of the Rebel Alliance?","Star Wars","Luke Skywalker","Han Solo","Darth Vader","Princess Leia Organa","Princess Leia Organa is a skilled diplomat and leader of the Rebel Alliance."
"Han Solo","Who is the charming smuggler and pilot of the Millennium Falcon?","Star Wars","Luke Skywalker","Princess Leia Organa","Darth Vader","Han Solo","Han Solo is the charming smuggler and pilot of the Millennium Falcon."
"Darth Vader","Who is the Sith Lord and former Jedi Knight with a deep voice and iconic helmet?","Star Wars","Luke Skywalker","Princess Leia Organa","Han Solo","Darth Vader","Darth Vader is the Sith Lord and former Jedi Knight with a deep voice and iconic helmet."
"Obi-Wan Kenobi","Who is a wise Jedi Master and mentor to Anakin Skywalker and Luke Skywalker?","Star Wars","Yoda","Chewbacca","Obi-Wan Kenobi","R2-D2","Obi-Wan Kenobi is a wise Jedi Master and mentor to Anakin Skywalker and Luke Skywalker."
"Yoda","Who is the ancient and wise Jedi Master who trained Luke Skywalker?","Star Wars","Chewbacca","R2-D2","C-3PO","Yoda","Yoda is the ancient and wise Jedi Master who trained Luke Skywalker."
"Chewbacca","Who is the loyal Wookiee co-pilot of the Millennium Falcon?","Star Wars","Yoda","R2-D2","C-3PO","Chewbacca","Chewbacca is the loyal Wookiee co-pilot of the Millennium Falcon."
"R2-D2","Who is the resourceful astromech droid often seen with Luke Skywalker?","Star Wars","Yoda","Chewbacca","C-3PO","R2-D2","R2-D2 is the resourceful astromech droid often seen with Luke Skywalker."
"C-3PO","Who is the protocol droid fluent in multiple languages and often paired with R2-D2?","Star Wars","Yoda","Chewbacca","R2-D2","C-3PO","C-3PO is the protocol droid fluent in multiple languages and often paired with R2-D2."
"Tatooine","What desert planet is Luke Skywalker's home and the location of the first Star Wars film?","Star Wars","Alderaan","Hoth","Endor","Tatooine","Tatooine is the desert planet that is Luke Skywalker's home and the location of the first Star Wars film."
"Alderaan","Which planet was destroyed by the Death Star in the original Star Wars film?","Star Wars","Tatooine","Hoth","Endor","Alderaan","Alderaan was destroyed by the Death Star in the original Star Wars film."
"Death Star","What is the name of the massive space station and superweapon built by the Empire?","Star Wars","Tatooine","Alderaan","Millennium Falcon","Death Star","The Death Star is the massive space station and superweapon built by the Empire."
"Millennium Falcon","What is the name of Han Solo's iconic starship?","Star Wars","Tatooine","Alderaan","Death Star","Millennium Falcon","The Millennium Falcon is Han Solo's iconic starship."
"Lightsaber","What weapon is commonly used by Jedi and Sith, with a blade of plasma?","Star Wars","Tatooine","Alderaan","Death Star","Lightsaber","A lightsaber is a weapon commonly used by Jedi and Sith, with a blade of plasma."
"The Force","What mystical energy field gives Jedi their power and binds the galaxy together?","Star Wars","Tatooine","Alderaan","Death Star","The Force","The Force is the mystical energy field that gives Jedi their power and binds the galaxy together."
"Battle of Yavin","In which battle did the Rebel Alliance destroy the first Death Star?","Star Wars","Battle of Hoth","Battle of Endor","Battle of Coruscant","Battle of Yavin","The Rebel Alliance destroyed the first Death Star in the Battle of Yavin."
"Battle of Hoth","In which icy battle did the Empire attack the Rebel Alliance on the planet Hoth?","Star Wars","Battle of Yavin","Battle of Endor","Battle of Coruscant","Battle of Hoth","The Empire attacked the Rebel Alliance in the Battle of Hoth on the planet Hoth."
"Battle of Endor","In which decisive battle did the Rebel Alliance confront the Empire's forces in the forest moon of Endor?","Star Wars","Battle of Yavin","Battle of Hoth","Battle of Coruscant","Battle of Endor","The Rebel Alliance confronted the Empire's forces in the Battle of Endor on the forest moon of Endor."
"Jabba the Hutt","Who is the notorious crime lord and owner of the palace on Tatooine?","Star Wars","The Jedi Council","Emperor Palpatine","Lando Calrissian","Jabba the Hutt","Jabba the Hutt is the notorious crime lord and owner of the palace on Tatooine."
"The Jedi Council","What is the governing body of Jedi Knights and Masters in the Star Wars universe?","Star Wars","Jabba the Hutt","Emperor Palpatine","Lando Calrissian","The Jedi Council","The Jedi Council is the governing body of Jedi Knights and Masters in the Star Wars universe."
"Emperor Palpatine","Who is the Sith Lord and Emperor who manipulated Anakin Skywalker to the dark side?","Star Wars","Anakin Skywalker","Padmé Amidala","Darth Vader","Emperor Palpatine","Emperor Palpatine is the Sith Lord and Emperor who manipulated Anakin Skywalker to the dark side."
"Anakin Skywalker","Who is the Jedi Knight who becomes Darth Vader after falling to the dark side?","Star Wars","Emperor Palpatine","Padmé Amidala","Grand Moff Tarkin","Anakin Skywalker","Anakin Skywalker is the Jedi Knight who becomes Darth Vader after falling to the dark side."
"Padmé Amidala","Who is the former Queen of Naboo and the love interest of Anakin Skywalker?","Star Wars","Emperor Palpatine","Anakin Skywalker","Grand Moff Tarkin","Padmé Amidala","Padmé Amidala is the former Queen of Naboo and the love interest of Anakin Skywalker."
"Grand Moff Tarkin","Who is the Imperial officer in charge of the Death Star in the original Star Wars film?","Star Wars","Emperor Palpatine","Anakin Skywalker","Padmé Amidala","Grand Moff Tarkin","Grand Moff Tarkin is the Imperial officer in charge of the Death Star in the original Star Wars film."
"Lando Calrissian","Who is the suave gambler and owner of Cloud City in 'The Empire Strikes Back'?","Star Wars","Emperor Palpatine","Anakin Skywalker","Padmé Amidala","Lando Calrissian","Lando Calrissian is the suave gambler and owner of Cloud City in 'The Empire Strikes Back'."
"Boba Fett","Who is the notorious bounty hunter with Mandalorian armor who captures Han Solo?","Star Wars","Emperor Palpatine","Anakin Skywalker","Padmé Amidala","Boba Fett","Boba Fett is the notorious bounty hunter with Mandalorian armor who captures Han Solo."
"Stormtroopers","What are the soldiers of the Galactic Empire known for their white armor and blasters?","Star Wars","X-wing","TIE Fighter","Rancor","Stormtroopers","Stormtroopers are the soldiers of the Galactic Empire known for their white armor and blasters."
"X-wing","What type of starfighter is commonly used by the Rebel Alliance with distinctive X-shaped wings?","Star Wars","TIE Fighter","Rancor","Bacta Tank","X-wing","The X-wing is a type of starfighter commonly used by the Rebel Alliance with distinctive X-shaped wings."
"TIE Fighter","What type of starfighter is primarily used by the Galactic Empire with twin ion engines?","Star Wars","X-wing","Rancor","Bacta Tank","TIE Fighter","The TIE Fighter is a type of starfighter primarily used by the Galactic Empire with twin ion engines."
"Rancor","What is the name of the large, carnivorous creature kept in Jabba the Hutt's palace?","Star Wars","X-wing","TIE Fighter","Bacta Tank","Rancor","The Rancor is the name of the large, carnivorous creature kept in Jabba the Hutt's palace."
"Bacta Tank","What medical device is used for healing injuries and is seen in 'The Empire Strikes Back'?","Star Wars","X-wing","TIE Fighter","Rancor","Bacta Tank","A Bacta Tank is a medical device used for healing injuries and is seen in 'The Empire Strikes Back'."
"AT-AT Walker","What is the four-legged Imperial walker used in the Battle of Hoth?","Star Wars","X-wing","TIE Fighter","Rancor","AT-AT Walker","The AT-AT Walker is the four-legged Imperial walker used in the Battle of Hoth."
"Rebel Alliance","What is the organized group that opposes the Galactic Empire in the Star Wars universe?","Star Wars","X-wing","TIE Fighter","Rancor","Rebel Alliance","The Rebel Alliance is the organized group that opposes the Galactic Empire in the Star Wars universe."
"Galactic Empire","What is the authoritarian regime ruled by Emperor Palpatine and Darth Vader in the Star Wars universe?","Star Wars","X-wing","TIE Fighter","Rancor","Galactic Empire","The Galactic Empire is the authoritarian regime ruled by Emperor Palpatine and Darth Vader in the Star Wars universe."
"Jedi Temple","What is the sacred Jedi training and meditation center on Coruscant?","Star Wars","X-wing","TIE Fighter","Rancor","Jedi Temple","The Jedi Temple is the sacred Jedi training and meditation center on Coruscant."
"Clone Troopers","What are the genetically engineered soldiers created for the Galactic Republic?","Star Wars","X-wing","TIE Fighter","Rancor","Clone Troopers","Clone Troopers are the genetically engineered soldiers created for the Galactic Republic."
"Slave I","What is the name of Boba Fett's ship, which is also his personal starship?","Star Wars","X-wing","TIE Fighter","Rancor","Slave I","Slave I is the name of Boba Fett's ship, which is also his personal starship."
"Mos Eisley Cantina","What is the infamous cantina on Tatooine where Luke and Obi-Wan meet Han Solo and Chewbacca?","Star Wars","X-wing","TIE Fighter","Rancor","Mos Eisley Cantina","The Mos Eisley Cantina is the infamous cantina on Tatooine where Luke and Obi-Wan meet Han Solo and Chewbacca."
"Endor Forest","What is the forested moon where the Rebel Alliance confronts the Empire in 'Return of the Jedi'?","Star Wars","X-wing","TIE Fighter","Rancor","Endor Forest","The Endor Forest is the forested moon where the Rebel Alliance confronts the Empire in 'Return of the Jedi'."
"Carbonite Freezing","What process is used to encase Han Solo in 'The Empire Strikes Back'?","Star Wars","Force Ghosts","Dagobah","Kashyyyk","Carbonite Freezing","Carbonite Freezing is the process used to encase Han Solo in 'The Empire Strikes Back'."
"Force Ghosts","What are the apparitions of deceased Jedi who can communicate with the living?","Star Wars","Carbonite Freezing","Dagobah","Kashyyyk","Force Ghosts","Force Ghosts are the apparitions of deceased Jedi who can communicate with the living."
"Dagobah","On which remote planet does Yoda live in exile and train Luke Skywalker in 'The Empire Strikes Back'?","Star Wars","Carbonite Freezing","Kashyyyk","Naboo","Dagobah","Dagobah is the remote planet where Yoda lives in exile and trains Luke Skywalker in 'The Empire Strikes Back'."
"Kashyyyk","What is the homeworld of the Wookiees, including Chewbacca?","Star Wars","Carbonite Freezing","Dagobah","Naboo","Kashyyyk","Kashyyyk is the homeworld of the Wookiees, including Chewbacca."
"Naboo","Which planet is the home of Padmé Amidala and Emperor Palpatine in the prequel trilogy?","Star Wars","Carbonite Freezing","Dagobah","Kashyyyk","Naboo","Naboo is the planet that is the home of Padmé Amidala and Emperor Palpatine in the prequel trilogy."
"Mustafar","On which fiery and volcanic planet does Anakin Skywalker have his fateful duel with Obi-Wan Kenobi?","Star Wars","Carbonite Freezing","Dagobah","Kashyyyk","Mustafar","Mustafar is the fiery and volcanic planet where Anakin Skywalker has his fateful duel with Obi-Wan Kenobi."
"Coruscant","What is the bustling city-covered planet that serves as the capital of the Galactic Republic and later the Galactic Empire?","Star Wars","Carbonite Freezing","Dagobah","Kashyyyk","Coruscant","Coruscant is the bustling city-covered planet that serves as the capital of the Galactic Republic and later the Galactic Empire."
"Geonosis","Where does the first battle between the Jedi and the Separatists take place in 'Attack of the Clones'?","Star Wars","Carbonite Freezing","Dagobah","Kashyyyk","Geonosis","The first battle between the Jedi and the Separatists takes place on Geonosis in 'Attack of the Clones'."
"Kessel Run","What is the famous hyperspace route known for its dangers and smuggler lore?","Star Wars","Carbonite Freezing","Dagobah","Kashyyyk","Kessel Run","The Kessel Run is the famous hyperspace route known for its dangers and smuggler lore."
"The Krayt Dragon","What is the massive, carnivorous creature found on Tatooine in 'A New Hope'?","Star Wars","Carbonite Freezing","Dagobah","Kashyyyk","The Krayt Dragon","The Krayt Dragon is the massive, carnivorous creature found on Tatooine in 'A New Hope'."
"Bespin","Which gas giant is the location of Cloud City, where Han Solo is frozen in carbonite?","Star Wars","Carbonite Freezing","Dagobah","Kashyyyk","Bespin","Bespin is the gas giant that is the location of Cloud City, where Han Solo is frozen in carbonite."
"Mon Mothma","Who is the leader of the Rebel Alliance and later the New Republic in the original Star Wars trilogy?","Star Wars","Carbonite Freezing","Dagobah","Kashyyyk","Mon Mothma","Mon Mothma is the leader of the Rebel Alliance and later the New Republic in the original Star Wars trilogy."
"General Ackbar","Who is the Mon Calamari admiral known for the line 'It's a trap!'in 'Return of the Jedi'?","Star Wars","Carbonite Freezing","Dagobah","Kashyyyk","General Ackbar","General Ackbar is the Mon Calamari admiral known for the line 'It's a trap!'in 'Return of the Jedi'."
"Ewoks","What are the small, furry inhabitants of the forest moon of Endor who aid the Rebel Alliance?","Star Wars","Carbonite Freezing","Dagobah","Kashyyyk","Ewoks","Ewoks are the small, furry inhabitants of the forest moon of Endor who aid the Rebel Alliance."
"Kylo Ren","Who is the antagonist in the sequel trilogy, also known as Ben Solo?","Star Wars","Carbonite Freezing","Dagobah","Kashyyyk","Kylo Ren","Kylo Ren is the antagonist in the sequel trilogy, also known as Ben Solo."
"BB-8","What is the astromech droid that accompanies Rey in the sequel trilogy?","Star Wars","Carbonite Freezing","Dagobah","Kashyyyk","BB-8","BB-8 is the astromech droid that accompanies Rey in the sequel trilogy."
"Porgs","What are the small, penguin-like creatures native to Ahch-To, seen in 'The Last Jedi'?","Star Wars","Carbonite Freezing","Dagobah","Kashyyyk","Porgs","Porgs are the small, penguin-like creatures native to Ahch-To, seen in 'The Last Jedi'."
"Sarlacc Pit","What is the creature in the Great Pit of Carkoon on Tatooine that swallows victims and digests them over a thousand years?","Star Wars","Carbonite Freezing","Dagobah","Kashyyyk","Sarlacc Pit","The Sarlacc Pit is the creature in the Great Pit of Carkoon on Tatooine that swallows victims and digests them over a thousand years."
"Trade Federation","What is the powerful, trade-oriented organization that blockades Naboo in 'The Phantom Menace'?","Star Wars","Carbonite Freezing","Dagobah","Kashyyyk","Trade Federation","The Trade Federation is the powerful, trade-oriented organization that blockades Naboo in 'The Phantom Menace'."
"Sith Temple","What is the hidden location where the Sith practiced their dark arts and rituals?","Star Wars","Rey","Finn","Poe Dameron","Sith Temple","The Sith Temple is the hidden location where the Sith practiced their dark arts and rituals."
